640;2908;88;;Squad 7's suppression of the enemy camp on&the west bank gave us the foothold we needed.;La soppressione dell'accampamento nemico da parte della Squadra 7&la riva occidentale ci ha fornito il punto d'appoggio di cui avevamo bisogno.;
656;3004;90;;Now we'll join the army's Vasel Battalion in&Operation Cloudburst to take back the bridge.;Ora ci uniremo al battaglione Vasel dell'esercito&nell'operazione Cloudburst per riconquistare il ponte.;
672;3100;87;;Militia forces will take the point, crossing the bridge&and attacking the eastern camp.;Le forze della milizia prenderanno il punto, attraversando&il ponte e attaccando l'accampamento orientale.;
688;3192;67;;Captain, crossing that bridge means breaching&the enemy bridgehead.;Capitano, attraversare quel ponte significa violare la&testa di ponte nemica.;
704;3264;77;;What sort of on-site backup and supplies can&we expect from the army on this?;Che tipo di supporto e rifornimenti in loco possiamo&aspettarci dall'esercito in questo caso?;
720;3348;88;;The plan calls for the army to commence its&operation after we've struck the bridgehead.;Il piano prevede che l'esercito inizi le sue operazioni&dopo aver colpito la testa di ponte.;
736;3444;62;;Wait a minute...&So we're just being offered up on a platter?!;Aspetta un attimo...e quindi ci stanno solo offrendo su un&piatto d'argento?!;
752;3512;76;;I know how you feel. I felt that way&when I was a militia foot soldier, too.;So come ti senti. Mi sentivo cosi anch'io quando ero un&soldato di fanteria della milizia.;
768;3596;82;;But sometimes being a soldier means taking&on tough missions. Even dangerous ones.;Ma a volte essere un soldato significa accettare missioni&difficili. Anche pericolose.;
784;3684;23;;...Understood, Captain.;...Capito, Capitano.;
800;3712;36;;I'm not saying you're wrong, Faldio.;Non sto dicendo che ti sbagli, Faldio.;
816;3756;68;;Breaching that bridgehead by ourselves is...&It's going to be tough.;Superare quella testa di ponte da soli >...&Sar= dura.;
832;3832;60;;Captain Varrot, may I go observe the area&around the bridge?;Capitano Varrot, posso andare a osservare la zona attorno&al ponte?;
848;3900;45;;Observe it? &I don't mind, but what do you...;Lo noti? A me non dispiace, ma cosa...;
864;3952;7;;Welkin!;Bentornato!;
880;3964;31;;Sergeant Melchiott? What is it?;Sergente Melchiott? Che cos'>?;
896;4000;40;;Oh, I... Sorry to interrupt the meeting.;Oh, io... Mi dispiace interrompere la riunione.;
912;4048;72;;We're finished, it's fine. Now I assume&there's a reason for your visit?;Abbiamo finito, va bene. Ora suppongo che ci sia un motivo&per la tua visita?;
928;4128;13;;Yes, Captain.;Si, capitano.;
944;4148;85;;Welkin, ah, I mean, Lieutenant Gunther... the squad,&they're at each others' throats.;Bene, ah, voglio dire, il tenente Gunther... la squadra...&sono uno alla gola dell'altro.;Welkin, ah, je veux dire, Lieutenant Gunther... l'escouade,&il
960;4240;5;;What?;Che cosa?;
976;4252;59;;Please stop them, sir. &I tried to, but they... I couldn't.;Per favore, fermali, signore. & Ho provato a farlo, ma&loro... Non ci sono riuscito.;
992;4316;27;;You want me to break it up?;Vuoi che lo divida?;
1008;4348;66;;I don't know... Maybe it'd be better to&just let them have it out.;Non lo so... Forse sarebbe meglio lasciarli semplicemente&sfogare.;
1024;4420;49;;Let them have it out?&You can't just ignore them!;Lasciarli sfogare? Non puoi semplicemente ignorarli!;
1040;4476;82;;I'm not ignoring them.&I think it's important that they say what they're thinking.;Non li ignoro e penso che sia importante che dicano cio'&che pensano.;
1056;4564;85;;Butting heads over differing opinions can be&one way to bring people closer together.;Scontrarsi per opinioni diverse puo' essere un modo per&avvicinare le persone.;
1072;4656;40;;Well, but... That may be, but I still...;Beh, ma... Puo' darsi, ma io ancora...;
1088;4704;86;;Look, you can't just sit here while your&squad's tearing itself apart. It's not right.;Guarda, non puoi semplicemente startene seduto qui mentre&la tua squadra si sta facendo a pezzi. Non > giusto.;
1104;4796;27;;Now, get a move on! ...Sir.;Ora, datevi una mossa! ...Signore.;
1120;4828;20;;H-Hey, I... Alicia?!;Ehi, io... Alicia?!;
1136;4856;36;;Sounds like he's got his hands full.;Sembra che abbia le mani occupate.;
1152;4900;35;;It's all part of growing as a team.;Tutto fa parte della crescita di una squadra.;
1168;4940;8;;Hold on!;Aspettare!;
1184;4956;27;;Okay, what's going on here?;Bene, cosa sta succedendo qui?;
1200;4988;5;;Hmph.;Mmh.;
1216;5000;35;;You really have to ask, Lieutenant?;Davvero ce lo chiede, tenente?;
1232;5040;27;;It's either her or me, pal.;O lei o me, amico.;
1248;5072;73;;Who let her in, anyway?&You really think I'm gonna work with a dark-hair?;Chi l'ha fatta entrare, comunque? Pensi davvero che&lavorerei con una mora?;
1264;5152;62;;She'll blow us all up,&besides I can't stand the stink of her.;Ci far= saltare tutti in aria e poi non sopporto il suo&fetore.;
1280;5220;88;;Her type's got a bad reputation and everybody knows it.&No Darcsens allowed. Ya hear me?;Il suo tipo ha una cattiva reputazione e tutti lo&sanno.&Non sono ammessi Darcsen. Mi hai sentito?;
1296;5316;92;;Oh yes, I've heard everything you have to say.&But I'm still a human being, the same as you.;Oh si, ho sentito tutto quello che hai da dire. Ma sono&pur sempre un essere umano, come te.;
1312;5416;94;;"Besides, no evidence exists to substantiate what you&call the ""Darcsen Calamity."" It's a myth.";"Inoltre, non esistono prove a sostegno di quella che tu&chiami la ""Calamit= di Darcsen"". E' un mito.";
1328;5516;51;;Excuse me?!?&So what, you're calling me stupid now?;Scusa?!? E allora, adesso mi dai dello stupido?;
1344;5572;23;;Stop it, that's enough.;Basta, basta.;
1360;5600;14;;Okay boss-man.;Okay, capo.;
1376;5620;74;;We won't fight alongside no Darcsen.&What about that can't you understand?;Non combatteremo al fianco di nessun Darcsen. Cosa non&riesci a capire?;
1392;5700;74;;Another thing we ain't doing is taking orders from some&hotshot greenhorn.;Un'altra cosa che non faremo > prendere ordini da qualche&novellino.;
1408;5780;41;;Alright fine. Now listen and listen good.;Va bene, bene. Ora ascolta e ascolta bene.;
1424;5828;57;;I'll have that bridge back in Gallia's hands in 48 hours.;Entro 48 ore restituiro' quel ponte nelle mani di Gallia.;
1440;5892;57;;Now, if my plan fails, which I doubt, then I'll resign...;Ora, se il mio piano fallisce, cosa di cui dubito, allora&mi dimettero'...;
1456;5956;33;;Squad 7 will be all yours, Largo.;La Squadra 7 sar= tutta tua, Largo.;
1472;5996;56;;But if my plan works, you'll take my orders and like it.;Ma se il mio piano funziona, accetterai i miei ordini e ti&piaceranno.;
1488;6060;12;;Ha ha ha ha!;Ah ah ah ah!;
1504;6080;44;;Your funeral, boss-man.&You sure about this?;Il tuo funerale, capo. Sei sicuro di questo?;
1520;6132;9;;Yes I am.;Si, io sono.;
1536;6148;28;;But... wait a sec... Welkin?;Ma... aspetta un attimo... Welkin?;
1552;6184;6;;......;......;
1568;6196;7;;Welkin!;Bentornato!;
1584;6208;14;;Hm? What's up?;Hm? Che succede?;
1600;6228;62;;What's up?! You just made an insane promise!&That's what's up!;Che succede?! Hai appena fatto una promessa folle! Ecco&cosa succede!;
1616;6296;66;;I'm sorry, Welks, I shouldn't have argued...&This is all my fault.;Mi dispiace, Welks, non avrei dovuto discutere... E' tutta&colpa mia.;
1632;6368;60;;It's nobody's fault, Is.&It's a war, we're all on edge here.;Non > colpa di nessuno, Is. E' una guerra, siamo tutti in&ansia qui.;
1648;6436;82;;And this mission certainly isn't helping.&It's little wonder the troops are upset.;E questa missione di certo non aiuta. Non c'> da stupirsi&che le truppe siano arrabbiate.;
1664;6524;7;;Yeah...;Si...;
1680;6536;85;;That's why pulling this operation off is the&perfect way to bring the squad together.;Ecco perch< portare a termine questa operazione > il modo&perfetto per riunire la squadra.;
1696;6628;31;;That'd be great, if it works...;Sarebbe fantastico se funzionasse...;
1712;6664;72;;But how can you possibly hope to take back &the bridge in just 48 hours?;Ma come puoi sperare di riprenderti il ponte in sole 48&ore?;
1728;6744;29;;Well, that's the hard part...;Beh, questa > la parte difficile...;
1744;6780;7;;...Aha!;...Ah!;
1760;6792;14;;Huh? Aha what?;Cosa? Aha cosa?;
1776;6812;36;;I was hoping, but... there they are.;Ci speravo, ma... eccoli li.;
1792;6856;43;;Isara, Alicia, think you can do me a favor?;Isara, Alicia, pensate che possiate farmi un favore?;
1808;6904;19;;Sure... What is it?;Certo... Che cos'>?;
1824;6928;17;;...You follow me?;...Mi segui?;
1840;6952;37;;But that's... Is that even possible?!;Ma >... E' davvero possibile?!;
1856;6996;44;;Well, Is? Think you can make it by tomorrow?;Bene, Is? Pensi di farcela entro domani?;
1872;7048;32;;Yes. I'll get to work on it now.;Si, mi metto al lavoro adesso.;
1888;7088;37;;...All right. I'll trust you on this.;...Va bene. Mi fido di te su questo.;
1904;7132;40;;Thanks, Alicia.&Well, let's get started!;Grazie, Alicia. Bene, cominciamo!;
1920;7180;42;;All right, let's hear this brilliant plan.;Bene, ascoltiamo questo brillante piano.;
1936;7228;72;;And it's too late to back out, boss-man.&You got that? So let's hear it!;Ed > troppo tardi per tirarsi indietro, capo.&Hai capito?&Allora sentiamo!;
1952;7308;60;;We're going to strike the enemy encampment on the east bank.;Colpiremo l'accampamento nemico sulla riva orientale.;
1968;7376;48;;Whoa, hold it.&You're askin' us to die for you?!;Ehi, aspetta un attimo! Ci stai chiedendo di morire per&te?!;
1984;7432;76;;One squad ain't breachin' that bridgehead,&buddy boy! That would be suicide!;Una squadra non sfonda quella testa di ponte, amico!&Sarebbe un suicidio!;
2000;7516;35;;We're not taking on the bridgehead.;Non ci occuperemo della testa di ponte.;
2016;7556;32;;We're taking on this. The river.;Ce ne occupiamo noi. Il fiume.;
2032;7596;77;;We use the fog as cover as we cross the river,&then launch a surprise attack.;Usiamo la nebbia come copertura mentre attraversiamo il&fiume e poi lanciamo un attacco a sorpresa.;
2048;7680;49;;Aww, c'mon!&Is this just some game to you, boy-o?;Dai, dai! Per te > solo un gioco, ragazzo?;
2064;7736;88;;Swimmin' a couple of foot soldiers over there&ain't gonna do much if we've got no tanks!;Mandare li un paio di soldati a piedi non servir= a molto&se non abbiamo carri armati!;
2080;7832;42;;Don't worry, I've got that covered.&Isara?;Non preoccuparti, ci penso io.&Isara?;
2096;7880;81;;I've fitted the Edelweiss with water-&resistant measures to allow for submersion.;Ho dotato l'Edelweiss di misure impermeabili per&consentirne l'immersione.;
2112;7968;70;;It will only hold for a few minutes,&but it should be enough to cross.;Durer= solo pochi minuti, ma dovrebbe essere sufficiente&per attraversare.;
2128;8044;79;;Hold on just a sec. Ships come through here!&It's gotta be too deep for a tank.;Aspetta un attimo. Le navi passano da qui! E deve essere&troppo profondo per un carro armato.;
2144;8128;41;;We're covered. Look. See that over there?;Siamo coperti. Guarda. Vedi quello laggiu'?;
2160;8176;19;;What's that, grass?;Cos'>, erba?;
2176;8200;71;;Mistlereed. A tall aquatic plant found in the&estuaries of some rivers.;Vischio. Una pianta acquatica alta che si trova negli&estuari di alcuni fiumi.;
2192;8276;80;;I noticed them when I came down to observe the river.&This stretch runs shallow.;Li ho notati quando sono sceso per osservare il fiume.&Questo tratto > poco profondo.;
2208;8364;60;;Shallow enough for a tank to drive across.&Trust me on this.;Abbastanza basso da permettere il passaggio di un carro&armato. Fidatevi.;
2224;8432;6;;......;......;
2240;8444;85;;First, the Edelweiss will cross over and&clear out any Imperial patrols on the shore.;Per prima cosa, l'Edelweiss attraverser= e sgomberer= la&riva da eventuali pattuglie imperiali.;
2256;8536;89;;Then Lieutenant Gunther will send up a flare,&signaling the rest of us to follow by boat.;Poi il tenente Gunther lancer= un razzo di segnalazione e&segnaler= al resto di seguirci in barca.;
2272;8632;62;;Right. Now, let's get started.&I'll see you on the other side!;Bene. Ora, cominciamo. Ci vediamo dall'altra parte!;
2288;8700;18;;Ya hear something?;Hai sentito qualcosa?;
2304;8724;23;;Yeah, I do. What is it?;Si, lo faccio. Che cos'>?;
2320;8752;9;;Beats me.;Non ci riesco.;
2336;8768;33;;Yell (running from the Edelweiss);Urlo (scappando dall'Edelweiss);
2352;8808;7;;Phew...;Uff...;
2368;8820;30;;The Edelweiss swims just fine!;L'Edelweiss nuota benissimo!;
2384;8856;13;;Fall in, 7's!;Avanti, 7!;
2400;8876;39;;Yell (surprised at the lurching bridge);Urlo (sorpreso dal ponte che sobbalza);
2416;8920;20;;Huh?! What was that?;Eh?! Che cosa era quello?;
2432;8948;39;;Yell (surprised at the lurching bridge);Urlo (sorpreso dal ponte che sobbalza);
2448;8992;35;;Yell (falling down the open bridge);Urlo (cadendo dal ponte aperto);
2464;9032;35;;Yell (falling down the open bridge);Urlo (cadendo dal ponte aperto);
2480;9072;35;;Yell (falling down the open bridge);Urlo (cadendo dal ponte aperto);
2496;9112;6;;Nnngh!;Noooo!;
2512;9124;8;;Waaaugh!;Oddio!;
2528;9140;79;;It appears that Lieutenant Gunther's plan worked.&An impressive start, soldier.;Sembra che il piano del tenente Gunther abbia funzionato.&Un inizio impressionante, soldato.;
2544;9224;19;;Thank you, Captain.;Grazie, Capitano.;
2560;9248;65;;The kid's crazy!&Drove a damn tank right into the stinkin' river!;Quel ragazzo > pazzo! Ha guidato un carro armato dritto&nel fiume puzzolente!;
2576;9320;56;;Yeah, and I can't believe it worked.&I'm still in shock.;Si, e non riesco a credere che abbia funzionato. Sono&ancora sotto shock.;
2592;9384;82;;All right, you two! Now hold up your side of the bargain&and you listen to Welkin.;Bene, voi due! Ora mantenete la vostra parte dell'accordo&e ascoltate Welkin.;
2608;9472;18;;Feh... Yeah, yeah.;Feh... Si, si.;
2624;9496;88;;The kid might got the chops to command,&but that don't mean I gotta like any dark-hairs.;Il ragazzo potrebbe avere le doti per comandare, ma questo&non significa che debba piacere a tutti i bruni.;
2640;9592;15;;Hey! Come on...;Ehi! Forza...;
2656;9612;41;;It's okay, Alicia.&I'm used to it by now.;Va bene, Alicia. Ormai ci sono abituato.;
2672;9660;80;;But I hope... I know the day will come when&Darcsens can join society as equals.;Ma spero... so che arriver= il giorno in cui i Darcsen&potranno unirsi alla societ= come pari.;
2688;9748;76;;Heyyy! Hope I'm not interrupting anything.&It's me again, reporting for GBS!;Ehiiii! Spero di non interrompere nulla. Sono di nuovo io,&a riferire per GBS!;
2704;9832;78;;Lieutenant Gunther! That was quite an&impressive result on your first mission.;Tenente Gunther! E' stato un risultato davvero&impressionante per la sua prima missione.;
2720;9916;85;;Yes, thanks to the squad's hard work,&we managed to take back the Great Vasel Bridge.;Si, grazie al duro lavoro della squadra siamo riusciti a&riconquistare il Ponte Grande Vasel.;
2736;10008;86;;Any impressions on things to come,&now that you've gotten your first taste of victory?;Hai qualche impressione su cosa succeder= ora che hai&assaporato per la prima volta la vittoria?;
2752;10100;31;;Impressions? Well, let's see...;Impressioni? Bene, vediamo...;
2768;10136;76;;Bridges are important.&They link the roads that bring people what they need.;I ponti sono importanti e collegano le strade che portano&alle persone cio' di cui hanno bisogno.;
2784;10220;90;;I'd like to become a sort of bridge,&linking my crew together. I think that's my new goal.;Vorrei diventare una specie di ponte, che collega la mia&squadra. Penso che questo sia il mio nuovo obiettivo.;
2800;10316;6;;......;......;
2816;10328;36;;Sorry, this is about all I can do...;Mi dispiace, > tutto quello che posso fare...;
2832;10372;34;;But maybe, once everybody returns,;Ma forse, una volta che tutti saranno tornati,;
2848;10412;85;;they'll see a couple of lion's paws blooming&and it'll start to feel like home again.;vedranno sbocciare un paio di zampe di leone e tutto&torner= a sentirsi come a casa.;
2864;10504;36;;Hey! Alicia!&We're heading out soon!;Ciao! Alicia!&Partiamo presto!;
2880;10548;26;;Okay! I'll be right there!;Ok! Arrivo subito!;
2896;10580;31;;Well, flowers... Do your stuff.;Bene, fiori... Fate il vostro dovere.;
