240;908;53;;All right, that's everyone.&Ready to move out, squad?;Bene, ci siamo tutti. Siete pronti a par-&tire, squadra?;
256;968;35;;You're crazy. You know that, right?;Sei pazzo. Lo sai, vero?;
272;1008;75;;Incoming message from Squad 1 leader Faldio&Landzaat on the west bank, sir.;Messaggio in arrivo dal leader della squ-&adra 1 Faldio&Landzaat dalla Cisgiordani-&a, signore.;
288;1088;84;;Enemy company in motion, presumed headed&east across the bridge toward our position.;Compagnia nemica in movimento, presumibi-&lmente diretta a est, oltre il ponte, ve-&rso la nostra posizione.;
304;1180;39;;A full company? That's bad news for us.;Un'azienda completa? Questa > una cattiv-&a notizia per noi.;
320;1224;76;;We'll have to move fast.&We're taking that camp before the cavalry rolls in!;Dobbiamo muoverci in fretta e prenderemo-& quell'accampamento prima che arrivi la -&cavalleria!;
336;1308;47;;What's all that noise? &Has something happened?;Cos'> tutto questo rumore? E' successo qu-&alcosa?;
352;1360;76;;"Emergency wire from alpha camp, sir!&""Under attack, request reinforcements!""";"Cavo di emergenza dal campo alfa, signor-&e! ""Sotto attacco, richiediamo rinforzi!-&""";
368;1444;79;;What?! How did Gallia get across?!&Agh, go wake the men up! Get out there, now!;Cosa?! Come ha fatto la Gallia ad attrav-&ersare?!&Agh, andate a svegliare gli uom-&ini! Uscite, subito!;
384;1528;80;;Come in, alpha camp. Alpha camp, respond.&We heard gunshots. Report your status!;Entrate, campo alfa. Campo alfa, rispond-&ete. Abbiamo sentito degli spari. Segnal-&ate il vostro stato!;
400;1616;80;;Come in, alpha camp. Alpha camp, respond.&We heard gunshots. Report your status!;Entrate, campo alfa. Campo alfa, rispond-&ete. Abbiamo sentito degli spari. Segnal-&ate il vostro stato!;
416;1704;46;;Welks, I've intercepted an enemy transmission.;Welks, ho intercettato una trasmissione -&nemica.;
432;1756;76;;There's nobody left at their camp to respond,&now that we've cleared it out.;Non c'> piu' nessuno nel loro accampament-&o che possa rispondere, ora che lo abbia-&mo ripulito.;
448;1840;79;;This is bad. It's only a matter of time&before they send in reinforcements now.;Questo > un male. E' solo questione di te-&mpo&prima che mandino rinforzi ora.;
464;1924;84;;This is alpha camp. A patrol unit had a misfire.&Condition green. Relax, we're fine.;Questo > un campo alfa. Un'unit= di patt-&uglia ha avuto un'accensione difettosa.&-&Condizione verde. Rilassati, stiamo bene-&.;
480;2016;84;;This is alpha camp. A patrol unit had a misfire.&Condition green. Relax, we're fine.;Questo > un campo alfa. Un'unit= di patt-&uglia ha avuto un'accensione difettosa.&-&Condizione verde. Rilassati, stiamo bene-&.;
496;2108;89;;Understood. Well, you guys keep the fires lit&'til it's time for our shift. Over and out.;Capito. Bene, voi ragazzi tenete accesi -&i fuochi finch< non > ora del nostro tur-&no. Passo e chiudo.;
512;2204;89;;Understood. Well, you guys keep the fires lit&'til it's time for our shift. Over and out.;Capito. Bene, voi ragazzi tenete accesi -&i fuochi finch< non > ora del nostro tur-&no. Passo e chiudo.;
528;2300;53;;Whew...&Apologies for acting without permission, sir.;Uff...e mi scuso per aver agito senza pe-&rmesso, signore.;
544;2360;21;;That was amazing, Is!;E' stato fantastico, Is!;
560;2388;84;;Between the squad's fast action and that fast talking,&we saved ourselves some heat.;Grazie alla rapidit= d'azione della squa-&dra e alla rapidit= delle chiacchiere, c-&i siamo risparmiati un po' di pressione.;
576;2480;55;;S-Sir!&Gallian commandos have occupied alpha camp, sir!;S-Signore! I commando Galliani hanno occ-&upato l'accampamento Alfa, signore!;
592;2540;61;;What?&Alpha camp reported their status green not minutes ago!;Cosa?&Alpha Camp ha segnalato il suo sta-&to verde solo pochi minuti fa!;
608;2608;78;;Y-Yes, but... Thinking back on it,&I didn't recognize the voice on the line...;S-Si, ma... Ripensandoci, non ho riconos-&ciuto la voce sulla linea...;
624;2692;37;;Damn it! Feed me misinformation, huh?;Accidenti! Mi dai una cattiva informazio-&ne, eh?;
640;2736;70;;I want every last man we have out there!&Bring me those Gallian heads!;Voglio tutti gli uomini che abbiamo l= f-&uori! E portatemi quelle teste di Gallia-&n!;
656;2812;84;;Incoming dispatch from Squad 1, sir.&That enemy company is almost across the bridge!;Dispaccio in arrivo dalla Squadra 1, sig-&nore. La compagnia nemica > quasi dall'a-&ltra parte del ponte!;
672;2904;29;;Rgh, our time is running out!;Rgh, il nostro tempo sta per scadere!;
688;2940;67;;Nice work!&We've occupied the enemy encampment at the bridge's end!;Ottimo lavoro! Abbiamo occupato l'accamp-&amento nemico all'estremit= del ponte!;
704;3012;39;;Drawbridge control room secured, Welks.;Messa in sicurezza della sala di control-&lo del ponte levatoio, Welks.;
720;3056;39;;Drawbridge control room secured, Welks.;Messa in sicurezza della sala di control-&lo del ponte levatoio, Welks.;
736;3100;68;;Excellent. Open it up, Is!&Let's see how their tanks like the river!;Ottimo. Aprilo, Is! E vediamo come si co-&mportano i loro acquari nel fiume!;
752;3176;68;;Excellent. Open it up, Is!&Let's see how their tanks like the river!;Ottimo. Aprilo, Is! E vediamo come si co-&mportano i loro acquari nel fiume!;
768;3252;9;;Yes, sir!;Si, signore!;
784;3268;9;;Yes, sir!;Si, signore!;cela signifie que le soldat est mort et incapable d'être utilisé A nouveau. Afin d'éviter cela, un allié doit prendre contact avec l'unité abattu avant cette fin tragique leur arrive.
800;3284;50;;Ragnite turbines on!&Stand by to raise drawbridge!;Turbine Ragnite accese! Pronti ad alzare-& il ponte levatoio!;(Medics) qui évacue et restaure leur santé en toute sécurité.
816;3340;349;; &             About Potentials& &Every unit possesses a set of innate&abilities known as Potentials, awakened&in combat under special set conditions,&such as remaining HP, terrain type, the&current turn number and other factors.& &Squad 7 is made up of a broad variety of&individuals, each with their own strengths&and shortcomings to keep in mind.;& Informazioni sui potenziali& &Ogni uni-&t= possiede una serie di abilit= innate -&note come potenziali, risvegliate&in com-&battimento in particolari condizioni sta-&bilite,&come i PV rimanenti, il tipo di -&terreno, il&numero del turno corrente e -&altri fattori.& &La squadra 7 > composta-& da un'ampia variet= di&individui, ognun-&o con i propri punti di forza&e difetti -&da tenere a mente.;
832;3696;615;; &             About Retreating& &At allied camps, you can substitute out&currently deployed units for soldiers&waiting in the reserves.&To send a unit to the reserves, move them&to a camp and press Enter once&the retreat command appears on screen.&Units returned to the reserves will have&both HP and ammo stores fully restored&and can be redeployed in a later phase.&To deploy a unit from the reserves, select&a camp in Command Mode to see a list of&available reserve units to select from.&This costs one CP and the number of units&you can call out from reserve is limited&to eight at a time, so choose carefully.;& Informazioni sulla ritirata& &Negli ac-&campamenti alleati, puoi sostituire le u-&nit= attualmente schierate con i soldati-& in attesa nelle riserve.& Per inviare u-&n'unit= nelle riserve, spostala& in un a-&ccampamento e premi Invio una volta& il -&comando di ritirata appare sullo schermo-&.& Le unit= riportate nelle riserve avra-&nno& sia HP che scorte di munizioni comp-&letamente ripristinati& e potranno esser-&e ridistribuite in una fase successiva.&-& Per schierare un'unit= dalle riserve, s-&eleziona& un accampamento in Modalit= co-&mando per vedere un elenco di& unit= di -&riserva disponibili tra cui scegliere.& -&Questo costa un CP e il numero di unit=&-& che puoi richiamare dalla riserva > lim-&itato& a otto alla volta, quindi scegli -&con attenzione.;
848;4316;189;; &           About Reinforcements& &Similarly, the enemy can call for backup&via their own camps.& &The only way to stop this from happening&is to occupy their camps as quickly as&possible.;& Informazioni sui rinforzi& &Allo stess-&o modo, il nemico puo' chiedere rinforzi&-&attraverso i propri accampamenti.& &L'un-&ico modo per impedire che cio' accada&> o-&ccupare i propri accampamenti il&piu' rap-&idamente possibile.;
864;4512;12;;About Medics;Informazioni sui medici;
880;4532;441;;Units whose HP have reached zero fall to&the ground in critical condition and&cannot be controlled using CP.&Leaving a unit in this state for three&turns, or allowing an enemy to touch them,&results in their being incapacitated.&Except in very few exceptional cases,&this means that the soldier is dead&and unable to be used again.&In order to prevent this, an ally must&make contact with the downed unit&before this tragic end befalls them.yWhen a unit reaches an ally in critical&condition, they call the medic, who safely&evacuates and restores them to health.;Le unit= i cui HP hanno raggiunto lo zer-&o cadono a terra in condizioni critiche -&e non possono essere controllate tramite-& CP. Lasciare un'unit= in questo stato p-&er tre turni o consentire a un nemico di-& toccarla comporta la sua incapacit=. Tr-&anne in pochissimi casi eccezionali, cio'-& significa che il soldato > morto e non -&puo' piu' essere utilizzato. Per evitare c-&io', un alleato deve entrare in contatto -&con l'unit= abbattuta prima che questa t-&ragica fine gli capiti. Quando un'unit= -&raggiunge un alleato in condizioni criti-&che, chiama il medico, che lo evacua in -&sicurezza e lo rimette in salute.;
896;4980;121;;When a unit reaches an ally in critical&condition, they call the medic, who safely&evacuates and restores them to health.;Quando un'unit= raggiunge un alleato in -&condizioni critiche, chiama il medico, c-&he lo evacua in sicurezza e lo rimette i-&n salute.;
