340;1408;13;;Oh, Alicia...;Oh, Alicia...
356;1428;65;;They said it missed her organs,&but she's still out cold, huh...?;Ils ont dit que ca avait rat< ses organes,&mais elle est toujours inconsciente, hein... ?
372;1500;69;;C'mon, boss.&There ain't nothin' we can do for her cooped up in here.;Allez, patron. Il n'y a rien que nous puissions faire&pour elle enferm< ici.
388;1576;81;;We really got our hands full,&keepin' those Imps from crashin' down on top of us.;Vraiment, nous avons du pain sur la planche pour <viter&que ces Imps s'abattent sur nous.
404;1664;49;;Yeah... You're right.&We'll be back soon, Alicia.;Ouais... Tu as raison.&Nous serons bientot de retour, Alicia.
420;1720;42;;Lieutenant Gunther... Might I have a word?;Lieutenant Gunther ... Pourrais-je vous parler?
436;1768;21;;Hmm? Sure, what's up?;Hmm ? Bien sur, qu'est ce qui se passe ?
452;1796;63;;Well, it's...&I'd feel more comfortable if we could talk alone.;Eh bien, c'est ... Je me sentirais plus = l'aise si nous&pouvions en parler en t$te = t$te.
468;1864;44;;Right. I'll head on back to the squad, boss.;Bien. Je vais rejoindre l'escouade, patron.
484;1916;47;;Thanks, Largo. &Get everyone ready to move out.;Merci, Largo. Pr<pare tout le monde pour y aller.
500;1968;61;;I'm sorry to keep you.&I know you've got a squad to run here.;Je suis d<sol<e de vous interrompre. Je sais que vous&avez une escouade = organiser la.
516;2036;22;;It's fine. What is it?;C'est bon. Alors qu'y a-t-il?
532;2064;82;;Well, I removed the bullet from Alicia's body,&but when I took a look at it, it...;Bien, j'ai enlev< la balle du corps d'Alicia,&mais quand j'ai jet< un coup d'oeil = cela, cela...
548;2152;85;;It's... The bullet wasn't of Imperial make.&It was a Gallian sniper rifle round, sir.;C'est ... La balle n'<tait pas de marque Imp<riale. C'<tait&une cartouche de fusil de sniper de Gallian, monsieur.
564;2244;9;;Wh-What?!;Qu-quoi? !
580;2260;80;;And not just a normal round, either.&It's part of a new series still in testing.;Et pas seulement une cartouche normale, en plus. Elle fait&partie d'une nouvelle s<rie encore en phase de test.
596;2348;70;;So you're saying...&You think Alicia was shot by someone on our side?!;Donc, vous dites... Vous pensez Alicia a <t< abattue&par quelqu'un de notre cot< ?!
612;2424;74;;I can't be completely sure, but...&I believe it's a very real possibility.;Je ne peux pas en $tre compl>tement sur, mais...&je crois que c'est une possibilit< tr>s r<elle.
628;2504;83;;But, why? What would anyone stand to gain&from shooting someone in their own camp?!;Mais pourquoi? Qu'aurait on = gagner en tirant sur&quelqu'un dans son propre camp ?!
644;2592;74;;Augh, those incompetents!&Why are they letting the Empire have their way?!;Augh, ces incomp<tents!&Pourquoi laissent-ils l'Empire agir = leur facon? !
660;2672;75;;With all due respect, General!&Our army isn't equipped to fight a Valkyria!;En toute d<f<rence, g<n<ral! Notre arm<e n'est pas <quip<e&pour combattre une Valkyria !
676;2752;80;;We ought to pull back for now,&and think of a strategy to neutralize her safely!;Nous devons nous retirer pour l'instant et penser = une&strat<gie afin de la neutraliser en toute s<curit< !
692;2840;19;;Eagh, quiet! Quiet!;Eagh, silence ! Silence !
708;2864;63;;If we pull out now,&how will I explain this to the higher-ups?!;Si nous nous retirons maintenant, comment vais-je&expliquer cela aux haut-plac<s? !
724;2932;79;;Tomorrow at noon we march on to the Empire again!&Every soldier we have fights!;Demain = midi, nous marcherons = nouveau sur l'Empire!&Chaque soldat devra combattre !
740;3016;8;;General!;G<n<ral!
756;3032;43;;Know your place, Varrot.&You are dismissed.;Tenez votre rang, Varrot.&Vous pouvez disposer.
772;3080;6;;Rgh...;Rgh ...
788;3092;76;;This is hopeless. We'll lose the whole army.&Isn't there...? What can we do?;C'est sans espoir. Nous allons perdre toute l'arm<e.&N'est ce pas ...? Que pouvons-nous faire?
804;3176;17;;Awaken, Valkyria.;R<veille-toi, Valkyria.
820;3200;57;;Your foe aims to rob this land of peace...&Kill them all!;Votre ennemi vise = d<pouiller cette terre de paix...&Tuez-les tous!
836;3264;21;;Listen to me, Gallia!;Ecoutez-moi, Gallia!
852;3292;38;;Cast aside your weapons and surrender!;D<posez vos armes et capitulez !
868;3336;31;;If you do not, Naggiar's plains;Si vous ne le faites pas, les plaines de Naggiar
884;3372;32;;will drink deeply of your blood!;s'abreuveront de votre sang!
900;3412;37;;Roar (responding to Selvaria's words);Rugissement (r<pondant aux mots de Selvaria)
916;3456;37;;Roar (responding to Selvaria's words);Rugissement (r<pondant aux mots de Selvaria)
932;3500;37;;Roar (responding to Selvaria's words);Rugissement (r<pondant aux mots de Selvaria)
948;3544;8;;G-gah...;G-gah...
964;3560;16;;Wait a minute...;Attend une minute...
980;3584;19;;I don't believe it.;Je n'y crois pas.
996;3608;28;;No! She can't be a Valkyria!;Non ! Elle ne peut pas $tre une Valkyria !
1012;3644;30;;Another scion to the Valkyrur?;Un autre descendant des Valkyrur?
1028;3680;31;;This world has no need for two.;Ce monde n'en a pas besoin de deux.
1044;3716;8;;Get out!;Disparait !
1060;3732;10;;Rraaaaugh!;Rraaaaugh !
1076;3748;6;;Augh?!;Augh? !
1092;3760;5;;Augh!;Augh !
1108;3772;6;;Haagh!;Haagh !
1124;3784;9;;Gyaaaugh!;Gyaaaugh !
1140;3800;16;;This can't be...;Ce n'est pas...
1156;3824;7;;Alicia!;Alicia !
1172;3836;15;;Medic! Medic!!!;Medic ! Medic!!!
1188;3856;15;;What happened?!;Que s'est-il pass<?!
1204;3876;72;;It looks like Alicia's passed out. &Can you get her back to base for me?;Il semble qu'Alicia ait perdu connaissance.&Pouvez-vous la ramener = la pour moi ?
1220;3956;9;;Yes, sir!;Oui, monsieur!
1236;3972;13;;Wh-What now?!;Qu-quoi maintenant? !
1252;3992;86;;The watershed battle on the Naggiar plains&ended in the victory of the Gallian forces.;La bataille des bassins versants sur les&plaines Naggiar s'est termin<e par&la victoire des forces de Gallia.
1268;4084;85;;It made military history not only with its&ferocity, but with the duel that ended it.;Cela a marqu< l'histoire militaire,&non seulement avec sa f<rocit<,&mais avec le duel qui y a mis fin.
1284;4176;127;;"The Imperial army then fell to retreat,&while Gallia's grasp on victory tightened.&&       Irene Koller, ""On the Gallian Front""";L'arm<e imp<riale a alors fait retraite,&tandis que l'<treinte de Gallia sur la&victoire se renforcait.&&    Irene Koller, £Sur le front Gallian£
1300;4308;27;;Alicia! Are you all right?!;Alicia ! Est-ce que ca va ?!
1316;4340;9;;Welkin...;Welkin...
1332;4356;54;;I'm... What happened?&I can't remember... What did...?;Je suis... Que s'est-il pass<? Je ne me souviens pas...&Que c'est... ?
1348;4416;63;;I was shot, wasn't I? &But here I am, alive and fully healed...;J'ai <t< touch<e, n'est ce pas? Mais je suis ici,&vivante et compl>tement gu<rie ...
1364;4484;77;;And it's like... Everyone looks at me differently now...&Like they're scared.;Et c'est comme... Tout le monde me regarde diff<remment&maintenant... Comme s'ils <taient effray<s.
1380;4568;61;;Welkin, did... Has something happened to me?&Tell me. Please!;Welkin, ... Quelque chose m'est arriv< ?&Dis-moi. S'il te plait !
1396;4636;9;;Alicia...;Alicia...
