6304;41964;341;;"Gallian government officials announced on the&17th that national qualifying examinations for&all trades will be cancelled. ""The ongoing&conflict has made safe and fair testing an&impossibility,"" authorities related at a press&conference. The cancelled tests correspond to&qualifications for six trades, with the baker&trade being the oldest.";Le gouvernement de Gallia a annonc< le 17 que&les examens de qualification nationaux pour&les m<tiers sont annul<s. £Le conflit en cours&a fait qu'un test sur et <quitable soit une&impossibilit<,£ ont racont< les autorit<s =&une conf<rence de presse. Les tests annul<es&correspondent aux qualifications pour six& m<tiers,  la boulangerie <tant le plus ancien.;;
6320;42312;294;;Gallian law has long required every baker to&train under a meister until he or she passes&the national exams to become a meister and&operate their own bakery in turn.&For the sake of Gallia's future bakers, as for&all the nation's people, it is imperative that&this war end as soon as possible.;La loi de Gallia exige depuis longtemps que&tout boulanger soit form< sous un meister&jusqu'= ce qu'il ou elle passe les examens&nationaux afin de devenir un Meister et&d'exploiter leur propre boulangerie = son tour&.Par souci pour le futur des boulangers de&Gallia, comme pour tous les gens de la nation&, il est imp<ratif que la guerre s'arr$te.;;
6336;42612;369;;The morning of the 28th brought news of the&Gallian force's victory at Naggiar. Though the&exact figures are still unclear, it is safe to&say that this win came at significant cost in&Gallian lives, with at least as many Imperial&casualties to match. That cost might have been&far greater had a second Valkyria not emerged&from among the Gallian force. In a duel fought;Le 28 au matin a apport< la nouvelle de la&victoire de la force de Gallia = Naggiar. Bien&que les chiffres exacts ne soient pas encore&clairs, on peut dire que cette victoire a eu&un cout prohibitif en vie Gallienne, et au&moins autant cot< Imp<rial. Cela aurait pu $tre&pire s'il n'y avait pas eu l'<mergence d'une &deuxi>me Valkyria parmi la force de Gallia.;;
6352;42988;288;;with the lances and shields of legend, it was&the Gallian woman who claimed victory, and the&remaining Imperial defenses fell soon after.&Though Army officials have issued no comment&on the Gallian Valkyria, the survivors of the&Naggiar operation likely have her to thank for&their lives.;Dans un duel, combattant avec les lances et&boucliers de la l<gende, c'est la femme de&Gallia qui a obtenu la victoire, et les&d<fenses imp<riales restantes sont tomb<es peu&de temps apr>s. Bien que les responsables de&l'arm<e n'aient <mis aucun commentaire sur la&Valkyria Gallienne, les survivants de Naggiar&peuvent surement la remercier d'etre en vie.;;
6368;43284;354;;The EHRI (Europan Human Rights Initiative) has&asked the continent's leaders to address the&mounting refugee problem. Armed conflict and&displaced people have long gone hand in hand,&but the current condition of Europa has&refugee numbers higher than ever recorded, and&the question of how to help them is fast&becoming a paramount issue. EHRI volunteers;L'EHRI (Action pour les droits de l'homme&d'Europa)a demand< aux dirigeants du continent&de r<gler le probl>me croissant des r<fugi<s.&Les conflits arm<s et les personnes d<plac<es&vont de pair depuis longtemps, mais le nombre &de r<fugi<s actuel est le plus <lev<e jamais&enregistr<, et comment les aider devient&une question primordiale. Les b<n<voles EHRI;;
6384;43644;353;;"are slated to be sent to camps all over the&continent to offer much-needed food and&medical treatment to their inhabitants.&Ben Tamal, an EHRI spokesman who has worked on&behalf of refugees for two decades, stated,&""Man's hopes for peace are hollow without the&will to cast aside superficial differences in&race, nation and religion in order to win it.""";ont pr<vus d'aller dans les camps partout sur&le continent afin d'offrir la nourriture et&traitement m<dical n<cessaire aux r<fugi<s.&Ben Tamal,un porte-parole EHRI, a d<clar<:&£Les espoirs de paix sont vides sans la&volont< de mettre de cot< les diff<rences&superficielles de race, de nation et de la&religion pour la gagner.£;;
6400;44004;367;;An Army relay has confirmed that Gallia took&the citadel at Ghirlandaio in the latest clash&at Gallia's border. The erstwhile headquarters&of the Imperial command fell after the Army&opened its front gates with an explosive rail-&car and subsequently flooded inside. Though no&official numbers were released, the operation&cost Gallia's forces significant casualties.;Une info de l'arm<e a confirm< que Gallia a&pris la citadelle de Ghirlandaio = la&fronti>re de Gallia. L'ex quartier g<n<ral du&commandement Imp<rial  est tomb< apr>s que&l'Arm<e ait ouvert ses portes avant avec un&wagonnet explosif puis envahis l'int<rieur.&Bien qu'aucun chiffre officiel n'ait <t< donn<& Gallia aurait eu des pertes importantes.;;
6416;44376;353;;Early the following morning, a huge explosion&of unknown cause razed the surrounding area,&annihilating the primary division of Gallia's&army with it. Commander of the central Gallian&force, Gen. Damon, was also lost in the blast.&At present, experts suspect an accident in the&citadel's armory as the cause, but no firm&details have yet been uncovered.;Tot le lendemain matin, une <norme explosion&de cause inconnue a ras< la r<gion alentour,&an<antissant la division principale de l'arm<e&de Gallia. Le Commandant de la force centrale&de Gallia, le G<n<ral Damon, a <galement <t<&perdu dans l'explosion.Les experts soupconnent&un accident dans l'arsenal de la citadelle,&mais aucun d<tail exact n'a encore <t< r<v<l<.;;
6432;44736;350;;In an independent investigation into the blast&at Ghirlandaio, our correspondent found the&blast radius and conditions of the aftermath&closely matched those in the Dreston &Incident within the Empire during EWI.&Caused when an explosion within the arsenal at&one Imperial outpost started a chain reaction&among weapons, gunpowder and a massive store;Dans une enqu$te ind<pendante sur l'explosion&= Ghirlandaio, notre correspondant a trouv<&que le rayon et l'<tat des s<quelles&correspondent <troitement = ceux de l'Incident&Dreston dans l'Empire au cours de EWI. Caus<e&quand une explosion au sein de l'arsenal d'un&avant-poste imp<rial a commenc< une r<action&en chaine avec les armes, la poudre et un;;
6448;45092;351;;of ragnoline, the blast erased most of Dreston&and remains one of the largest ever recorded.&The Gallian military has maintained its claim&that an investigation is underway, offering no&further comment on the matter.&Eyewitness accounts confirm the characteristic&blue glow of ragnite was present, reinforcing&the possibility of a ragnoline explosion.;stock massif de ragnoline, l'explosion a ras<&quasi totalement Dreston et reste l'une des&plus importantes jamais enregistr<es. L'arm<e& annonce seulement qu'une enqu$te est en cours&, n'offrant aucun autre commentaire. Des&t<moignages confirment que la lueur bleue&caract<ristique de la ragnite <tait pr<sente,&renforcant la th<orie d'explosion de ragnoline;;
6464;45448;360;;"The massive vehicle spotted exiting the Kloden&wildwood has been confirmed as the dreadnought&""Marmota."" Developed in secret, this marks&the weapon's first use in real combat.&Faced with the absence of Gallia's Army, the&militia and Randgriz Royal Guard joined hands&in Operation Maiden's Shield, a bid to destroy&the Imperial juggernaut as it traveled a gully";Le v<hicule massif rep<r< sortant du Wildwood&Kloden a <t< identifi< comme le dreadnought&£Marmota.£ D<velopp< en secret, c'est la&premi>re utilisation de l'arme en combat r<el.&La milice et la Garde Royale de Randgriz se&sont joints pour l'Op<ration Bouclier de la&Vierge, dans le but de d<truire le mastodonte&Imperial alors qu'il passait dans un ravin;;
6480;45816;327;;shortly after leaving Kloden. Though the team&effort managed to inflict damage to the tank's&starboard hull, the operation ended in failure&and the loss of most of the Royal Guard.&Upon word of this, Gallian Army HQ ordered the&capital placed under maximum security, with&defensive patrols stationed along the&city's perimeter.;peu apr>s avoir quitt< Kloden. Bien que le&travail d'<quipe a inflig< des d<gats = la&coque tribord du char, l'op<ration s'est&termin<e par un <chec et la perte de la&plupart des Gardes Royaux. Apres en avoir eu&connaissance, le QG de l'Arm<e de Gallia a&plac< la capitale sous s<curit< maximale, avec&des patrouilles sur le p<rim>tre de la ville.;;
6496;46148;337;;"The Europan Transnational Union's Security&Council entreated the warring Federation and&Empire on the 4th to come together for peace&talks, brokered by the ETU.&An emissary sent to meet separately with the&foreign ministers of both nations reported a&disappointing result. ""Truly saddening,"" he&proclaimed. ""Neither power showed any sign";Le 4, le Conseil de s<curit< de l'Union&transnationale d'Europa supplia les&bellig<rantes F<d<ration et Empire de se&r<unir pour des pourparlers de paix, n<goci<s&par l'ETU. Un <missaire envoy< voir s<par<ment&les ministres des Affaires <trang>res des deux&pays a rapport< un r<sultat d<cevant.&£Vraiment triste,£ at-il proclam<.;;
6512;46492;205;;"of interest regarding a compromise that might&end this bloodshed."" Seeing the possibility&of peace talks nipped in the bud makes it seem&likely that the conflict will grow more heated&still before abating.";£Aucune des puissances n'a montr< de signe&d'int<r$t concernant un compromis qui pourrait&mettre fin = cette effusion de sang.£ Voir la&possibilit< de pourparlers de paix <touff<&dans l'oeuf fait paraitre probable que le&conflit va se faire encore plus ardent avant&de diminuer.;;
6528;46704;358;;The 3rd Regiment, our correspondence partners&in the Gallian militia, succeeded in putting&Imperial tank ace Gen. Radi Jaeger to rout at&Vasel, a stone's throw away from the capital.&With Jaeger defeated, the Empire's invading&force consists solely of the Marmota,&still on the advance towards Randgriz's gates,&and an accompanying squad following behind it.;Le 3e R<giment, nos partenaires de&correspondance dans la milice Gallian, a&r<ussi = mettre l'As des chars Imperial le&G<n<ral Radi Jaeger en d<route = Vasel, = un&jet de pierre de la capitale. Avec Jaeger&vaincu, la force d'invasion de l'Empire se&compose uniquement du Marmota, toujours en&progression vers les portes de Randgriz, et;;
6544;47068;258;;This miraculous win has given Gallia a spark&of the hope that was all but lost after the&failure of Operation Maiden's Shield.&In the wake of their victory, the militia has&taken hold of the Great Vasel Bridge and begun&to move out in pursuit of the Marmota.;une escouade d'accompagnement qui suit&derri>re.Cette victoire miraculeuse a donn< =&Gallia une <tincelle d'espoir qui avait <t<&presque perdue apr>s l'<chec de l'op<ration&Bouclier de la Vierge. Dans la foul<e de leur&victoire, la milice s'est empar<e du Grand&pont de Vasel et a commenc< = se d<placer =&la poursuite de la Marmota.;;
6560;47332;358;;The Gallian government has issued an emergency&draft of all able-bodied Randgrizers to form a&last-ditch defensive line against the incoming&Imperial dreadnought Marmota. The draft&encompasses everyone ages 15 to 29, as well as&men of ages 30 to 45. Because of its grave&ramifications for Gallia's economy, only&Princess Cordelia possesses the constitutional;Le gouvernement de Gallia a <mis un enrolement&d'urgence aupr>s de tous les Randgrizers&valides pour former une ligne d<fensive de la&derni>re chance contre le dreadnought Marmota.&Cela englobe les 15 = 29ans, ainsi que des&hommes de 30 = 45. En raison des cons<quences&pour l'<conomie de Gallia, seul la princesse&Cordelia poss>de le droit Constitutionnel;;
6576;47696;358;;right to enact this third draft. The Princess,&however, has not been seen in public since her&appearance at a Parliamentary meeting late&last month, and rumors from within Castle&Randgriz suggest she may be seriously ill.&At present, Prime Minister Borg is handling&nearly all of Gallia's political affairs, with&this draft proposal bearing his name as well.;d'<dicter ce troisi>me enrolement. Cependant,&la princesse n'a pas <t< vue en public depuis&une r<union parlementaire = la fin du mois&dernier, et les rumeurs sugg>rent qu'elle&serait peut $tre gravement malade. = l'heure&actuelle, le Premier ministre Borg s'occupe de&presque toutes les affaires politiques, son&nom <tant appos< aussi pour cet enrolement.;;
