4208;16252;29;;It was pure luck I was there.;C'est par pure chance que j'<tais l=.
4224;16288;80;;So, have you seen the headlines?&The ones that say nothing about the kidnapping?;Alors, as-tu vu la une des journaux ?&Rien est dit sur l'enl>vement ?
4240;16376;79;;That reporter tells me Borg's the one&pressuring the media into suppressing it.;Ce journaliste m'a dit que Borg est celui qui fait pression&sur les m<dias pour le supprimer.
4256;16460;20;;But why suppress it?;Mais pourquoi le supprimer?
4272;16488;92;;If word got out about what happened,&Gallia's relationship with the Federation would suffer.;Si un mot <tait sorti sur ce qu'il s'est pass<, la relation&de Gallia avec la F<d<ration en souffrirait.
4288;16588;85;;We've got our hands full fending off the Empire.&We can't afford a war on two fronts.;Nous sommes d<j= bien occup<s pour repousser l'Empire.&Nous ne pouvons nous permettre une guerre sur deux fronts.
4304;16680;88;;So he has the whole thing covered up.&I'll bet he goes on acting like it never happened.;Il a donc tout couvert. Je parie qu'il continue d'agir&comme s'il ne s'<tait rien pass<.
4320;16776;4;;Wow.;Wow.
4336;16788;74;;Welkin, this hurts.&It's painfully obvious how shaky Gallia's standing is.;Welkin, cela fait mal. Il est douloureusement <vident de&savoir comme la position de Gallia est fragile.
4352;16868;78;;I know the world's history is an endless&chain of big fish eating little fish.;Je sais que l'histoire du monde est une chaine sans fin de&gros poissons mangeant les petits poissons.
4368;16952;73;;Both of us know the weak bow to the strong.&It's history and it's nature.;Nous savons tous que les faibles s'inclinent devant&les forts. C'est historique et naturel.
4384;17032;87;;A minor nation like ours is an easy mark,&even before you add the rift within our army.;Une nation mineure comme la notre est une cible facile,&avant m$me d'ajouter le foss< au sein de notre arm<e.
4400;17124;58;;Welkin...&No offense, but I hope nature's wrong this time.;Welkin ... Sans offense, mais j'esp>re que la nature&sera contredite cette fois.
4416;17188;37;;I don't know what to tell you Faldio.;Je ne sais pas quoi te dire Faldio.
