5712;29328;363;;barricade, the militia opted to swim a tank&across the river and attack from the rear, an&unconventional strategy to say the least. The&drawbridge was then opened, dumping the rest&of the defensive force into the drink. The man&behind this bold plan, Welkin Gunther (22), is&none other than the son of EWI hero Belgen&Gunther. This acorn hasn't fallen far at all.;de l'Empire, la milice a fait passer un char&dans la rivi>re et attaqu< par l'arri>re, une&strat<gie non conventionnelle pour le moins.&Puis le pont-levis a <t< ouvert,faisant tomber&les forces restantes dans l'eau. L'homme&derri>re ce plan audacieux, Welkin Gunther(22)&est le fils du h<ros de EWI Belgen Gunther.&Les chiens ne font pas des chats apr>s tout.;;
5728;29696;355;;On the 20th, the Gallian forces in the north&announced their retreat from the area. Though&no details were given, the Imperial takeover&of Fouzen, keystone among the north Gallian&industrial cities, is likely a chief cause.&The capture of Fouzen, a center for Gallia's&ragnite, steel and oil refineries, struck a&massive blow to the nation's productivity.;Le 20, les forces Gallienne dans le nord ont&annonc< leur retraite de la r<gion. Bien&qu'aucun d<tail n'ait <t< donn<, la prise de&controle Imp<riale de Fouzen, clef de voute&entre les villes industrielles Gallian nord,&en est probablement la cause principale. La&capture de Fouzen, un centre pour la ragnite&de Gallia, acier et raffineries d'huile,;;
5744;30056;205;;Though the meeting among Gallian army leaders,&held the day word of Fouzen's fall arrived,&lasted well into the night, no official word&has yet been issued as to a specific plan for&liberation of the city.;a frapp< d'un coup de massue = la productivit<&de la nation. Bien que la r<union entre les&dirigeants de l'arm<e de Gallia, tenue le jour&ou l'annonce de la chute de Fouzen est arriv<e&, ait dur< tard dans la nuit, aucun mot&officiel n'a encore <t< d<livr< sur un plan&sp<cifique pour la lib<ration de la ville.;;
5760;30268;359;;The militia's 3rd Regiment, partner in our&ongoing war correspondence, was successful in&seizing the Empire's supply base in the Kloden&wildwood despite interference from Empire ace&Gen. Radi Jaeger. This new victory, coming on&the heels of their Vasel win last month that&pushed the invasion back to central Gallia,&has all of Randgriz singing their praises.;La milice du 3e R<giment a r<ussi = s'emparer&de la base d'approvisionnement de l'Empire&dans Wildwood Kloden malgr< l'ing<rence de&l'As de l'Empire le g<n<ral Radi Jaeger. Cette&nouvelle victoire, dans la foul<e de leur&victoire = Vasel le mois dernier qui ont&repouss< l'invasion au centre de Gallia, fait&que tout Randgriz chante leurs louanges.;;
5776;30632;297;;Losing the Kloden base was no doubt a severe&blow to the Imperial force looking to regain&some of that lost ground, which is good news&to Gallians everywhere. It's anyone's guess&where the militia will crop up next, but their&efforts so far make one thing clear: these men&and women mean business.;Perdre la base Kloden a <t< sans aucun doute&un coup s<v>re = la force imp<riale cherchant&= reprendre une partie de ce terrain perdu, ce&qui est de bonnes nouvelles pour les Galliens&ou qu'ils soient. On ne sait pas encore ou la&milice ira prochainement, mais leurs efforts&jusqu'= pr<sent a mis une chose au clair: &ces hommes et femmes ne sont pas des rigolos.;;
5792;30936;345;;The government issued a second wave of drafts&among Gallians for the militia on the 8th.&Expected since the Empire's formal declaration&of war last month, this draft was likely made&inevitable by the recent series of losses in&the east and north. The draft will target&males, aged 30 to 45, selected based on&qualifications and their impact upon;Le gouvernement a lanc< une deuxi>me vague&d'enrolement Galliens dans la milice le 8.&Attendu depuis la d<claration de guerre&officielle de l'Empire le mois dernier,&cet enrolement a probablement <t< rendue&in<vitable par la r<cente s<rie de pertes dans&l'est et le nord. Le projet ciblera les hommes&, ag<s de 30 = 45, s<lectionn<s sur la base;;
5808;31288;220;;Gallia's normal function. The militia is also&accepting volunteers from those not included&in the second draft, but many worry about the&economic strain that further losses to the&commerce and industry sector may impose.;de leurs qualifications et de leur impact sur&le fonctionnement normal de Gallia. La milice&accepte aussi les b<n<voles pour ceux non&inclus dans le deuxi>me enrolement, mais&beaucoup s'inqui>tent de la pression sur&l'<conomie que de nouvelles pertes pour le&secteur du commerce et de l'industrie&pourraient infliger.;;
5824;31516;361;;Central Gallian command reported on the 15th&that the militia had encountered and routed a&contingent of Imperials stationed in Barious,&the culmination of a clandestine investigation&into reported Imperial activity in the area.&The badlands' topography is poorly suited to&combat maneuvers and the region holds little&to no strategic value, making the Empire's;Le centre de commandement de Gallia a rapport<&le 15 que la milice avait rencontr< et mis en&d<route un contingent d'Imp<riaux stationn<es&dans Barious, l'aboutissement d'une enqu$te sur&l'activit< Imp<riale signal<e dans la r<gion.&La topographie des badlands est mal adapt<e&aux manoeuvres de combat et de la r<gion n'a&plus ou moins aucune valeur strat<gique,;;
5840;31884;183;;goal there unclear. One theory suggests that&the desert region is home to an as-yet-unmined&lode, and that Imperial forces were stationed&there for the purpose of ragnite speculation.;rendant l'objectif de l'Empire&incompr<hensible. Une th<orie sugg>re que la&r<gion d<sertique a un filon non encore non&exploit<, et que les forces imp<riales <taient&stationn<es l=-bas dans un but de prospection&de ragnite.;;
5856;32072;344;;During a press session on the 10th, Gallian&Prime Minister Borg called for talks with&Federation Ambassador Townshend, slated to&visit Gallia at the end of the month.&In light of the increasingly complex conflict&between the Federation and Empire, however,&many suspect the Federation views this as a&chance to acquire Gallia for its resources.;Lors d'une conf<rence de presse le 10, le&Premier Ministre Borg a appel< = entamer des&n<gociations avec l'Ambassadeur Townshend de&la F<d<ration qui devrait visiter Gallia = la&fin du mois. A la lumi>re des rapports entre&la F<d<ration et l'Empire,beaucoup soupconnent&la F<d<ration de voir cela comme une chance&d'acqu<rir Gallia pour ses ressources.;;
5872;32424;340;;"This announcement has been met with vehement&opposition from members of the Parliament with&strong ties to the former Imperial cartels.&Ambassador Townshend responded to the invite&in a public address, stating that he ""firmly&believes that joining hands to thwart the&Empire's hubristic ambitions is essential to&assuring peace for Europa.""";Cette annonce a rencontr< la v<h<mente&opposition de la part des membres du Parlement&ayant avec des liens <troits avec les anciens&cartels imp<riaux. L'Ambassadeur Townshend a&r<pondu = l'invitation en d<clarant qu'il&£croit fermement que se serrer les coudes pour&contrecarrer les ambitions arrogantes de&l'Empire est essentiel pour assurer la paix.£;;
5888;32772;353;;Central Gallian command reports that a recent&chance encounter with Maximilian, Imperial&commander of the Gallian invasion, near the&ruins in central Barious ended in the&Empire's defeat and retreat from the badlands.&Speaking with one Gallian soldier who fought&in the desert operation revealed a shocking&eyewitness account of one female soldier among;Le centre de commandement Gallien rapporte&qu'une rencontre fortuite avec Maximilien,&commandant Imp<rial d'invasion de Gallia, pr>s&des ruines de Barious se termina par la&d<faite et la retraite de l'Empire. Un soldat&Gallien qui a combattu dans l'op<ration nous a&fait un compte rendu choquant qu'une femme&soldat parmi l'arm<e ennemie aurait envoy<;;
5904;33132;364;;the Empire's army batting a tank shell out of&the air by brute force. Army doctors looked&into the possibility of combat stress-induced&hallucination, but several other testimonies&have arisen to corroborate this wild account.&Other reports suggest she resembled one of the&Valkyrur of legend, while the Gallian Army has&issued no official statement on the matter.;un obus de char en l'air par force brute. Les&m<decins de l'arm<e pensaient = une&hallucination induite par le stress, mais&plusieurs autres t<moignages ont surgi pour&corroborer ce compte rendu un peu fou.D'autres&rapports sugg>rent qu'elle ressemblait = l'une&des Valkyrur de la l<gende,mais l'arm<e n'a&fait aucune d<claration officielle sur ceci.;;
5920;33504;366;;Chief Valence of the Gallian Geological Survey&reported recent discoveries of three new lodes&of ragnite amid the southeastern mountains.&Imperial capture of the key cities in ragnite-&rich northern Gallia has meant a steady drain&on domestic productivity. Paired with a rising&demand for ragnite for military uses, scarcity&of the ore has become a critical problem.;Le Chef Valence de la Commission g<ologique de&Gallia a rapport< la d<couverte de 3 nouveaux&filons de ragnite dans les montagnes du&sud-est. La capture des villes cl<s dans le&nord riche en ragnite a entrain< une baisse de&la productivit< nationale. Avec une demande&croissante pour des usages militaires, sa&raret< est devenue un probl>me critique.;;
5936;33876;269;;"At the latest Survey meeting, Chief Valence&stated that the new discovery would ""likely&go a long way toward filling the vacuum that&has hounded the Gallian energy supply of late.""&Investigations into the size and quality of&the newly found lode are currently underway.";Lors de la derni>re r<union de la Commission,&chef Valence a d<clar< que la nouvelle&d<couverte devrait £aller probablement dans le&bon sens en vue de combler le vide qui a&frapp< l'approvisionnement <nerg<tique Gallien&derni>rement.£ Les recherches sur la taille et&la qualit< du filon nouvellement trouv< sont&actuellement en cours.;;
5952;34152;363;;After months of deadlock, the southern Gallian&force broke through the defenses at Norville&on the 14th. Built along a natural wall of&thick forest, the enemy encampment had managed&to resist all prior advances. According to the&official report, Regiment 10 of Gallia's Army&was responsible for this victory, but our on-&site correspondent calls it a militia win.;Apr>s des mois d'impasse, la force sud de&Gallia a franchi les d<fenses = Norville le 14&Construit le long du mur naturel de la for$t&<paisse, le campement ennemi avait r<sister =&toutes les tentatives ant<rieures. Selon le&rapport officiel, le R<giment 10 aurait obtenu&cette victoire, mais notre correspondant sur&place dit que le m<rite en revient = la milice;;
5968;34520;364;;En route back from their operation at Barious,&Squad 7 of the militia's 3rd Regiment met with&a surprise attack from the Imperial defenses&at Norville and engaged the enemy in combat.&Squad 7's brilliant efforts created a crack in&the Empire's defense that Army Regiment 10 was&able to exploit in a swift blitz, breaking the&Norville defensive line apart for good.;En revenant de leur op<ration = Barious,&l'Escouade 7 de la milice du 3i<me R<giment a&fait une attaque surprise sur les d<fenses&imp<riales de Norville et engag< l'ennemi.&Leurs brillants efforts ont cr<< une br>che&dans la d<fense de l'Empire que le R<giment 10&de l'Arm<e a <t< en mesure d'exploiter dans un &blitz rapide,finissant la capture pour de bon.;;
5984;34892;346;;An EGP release issued on the 20th announced&that the Glory of Speed (GOS), Europa's top&motor race, has been called off for the year.&This marks the first such cancellation in the&event's 24-year history, likely the result of&difficulties in hosting an international race&of this scale amid the worsening conflicts&unfolding across the continent.;Un communiqu< d'EGP <mis le 20 a annonc< que&la Glory of Speed (GOS), la course automobile&d'Europa, a <t< annul<e cette l'ann<e. C'est&la premi>re annulation sur les 24 ans&d'histoire de l'<v<nement, venant probablement&de la difficult< d'accueillir une course&internationale de cette ampleur au milieu des&conflits dans le continent.;;
6000;35244;365;;The progress being made by automobile makers&today is largely drafted into military use,&and more than a few manufacturers have spurned&such public events for fear of trade (and by&extension, government) secrets being leaked,&further informing the decision to call off the&race. These explanations offer little solace,&though, to disappointed racers and their fans.;Les progr>s r<alis<s par les constructeurs&automobiles sont en grande partie d<di< aux&usages militaires, de plus quelques fabricants&ont repouss< ces <v<nements publics par&crainte que leurs secrets fuitent, expliquant&ainsi leur d<cision d'abandonner la course.&Ces explications offrent peu de r<confort &pour les coureurs et leurs fans d<cus.;;
6016;35616;370;;A Wall-exclusive scoop! Early morning on the&23rd, Princess Cordelia was abducted and taken&forcibly from the grounds of Castle Randgriz.&Subsequent investigation has shown the culprit&was Federation Ambassador Townshend, in Gallia&on an official visit. After a banquet at the&castle, he forced the princess into an armored&vehicle he had prepared and made for the port.;Un scoop exclusif du Mur! Tot le matin du 23,&la princesse Cordelia a <t< enlev<e et emmen<e&de force de l'enceinte du Chateau Randgriz.&L'enqu$te a montr< que le coupable <tait&l'ambassadeur Townshend de la F<d<ration, ici&pour une visite officielle. Apr>s le banquet&, il a forc< la princesse = monter dans un&v<hicule blind< et est parti pour le port.;;
6032;35992;328;;Thankfully, his escape was thwarted by members&of Squad 7 of the Gallian militia, who safely&recovered Princess Cordelia in time.&The Gallian government has declined to address&this matter publicly, likely in an effort not&to endanger relations with the Federation&while Gallia remains locked in combat with the&Empire's forces.;Heureusement, son <vasion a <t< contrecarr<e&par l'Escouade 7 de la milice, qui a r<cup<r<&= temps la princesse Cordelia. Le gouvernement&Gallien a refus< d'aborder cette question&publiquement, probablement dans un effort de&ne pas compromettre les relations avec la&F<d<ration alors que Gallia est engag< dans&le combat avec les forces de l'Empire.;;
6048;36328;365;;Castle Randgriz's Audience Hall saw an award&ceremony on the 28th in which militia officer&Lieutenant Welkin Gunther (22) was presented&the prestigious Gallian Medal of Honor, given&to those who have gone above and beyond the&call of duty in service of Gallia's interests.&The unicorn-emblazoned medal was presented by&Princess Cordelia herself, who also graced the;La salle d'audience du Chateau Randgriz fut&le th<atre le 28 d'une c<r<monie de r<compense&dans laquelle le lieutenant Welkin Gunther(22)&a recu  la prestigieuse M<daille d'Honneur&Gallienne, donn<e = ceux qui ont grandement&servi les int<r$ts de Gallia. La m<daille&orn<-d'une-licorne a <t< pr<sent< par la&princesse Cordelia elle-m$me, qui a <galement;;
6064;36700;357;;"young soldier with wishes for his continued&loyalty. After the ceremony, Gunther addressed&the press, saying that he hoped to ""do right&by this honor by becoming a better man and&officer,"" medal hung proudly around his neck.&The Gunther family has the rare distinction of&being among the first to receive this highest&of awards twice in as many generations.";honor< le jeune soldat avec des souhaits pour&que sa loyaut< perdure. Apr>s la c<r<monie,&Gunther s'est adress< = la presse, disant&qu'il esp<rait £r<pondre = cet honneur en&devenant un meilleur homme et officier,£.&La famille Gunther a la rare distinction&d'$tre parmi les premi>res = recevoir la plus&haute des r<compenses 2 fois en 2 g<n<rations.;;
6080;37064;356;;On the 10th, central Gallian forces were&successful in freeing the northern industrial&cities from Imperial control. The Gallian Army&and militia worked in tandem to take Fouzen,&Dieseehl and Janluc back simultaneously.&Surviving members of the Empire's defense were&seen staging a mass retreat from the north as&the Gallian Army began its seek-and-destroy;Le 10, les forces centrales de Gallia ont&r<ussi = lib<rer les villes industrielles du&Nord du controle imp<rial. L'arm<e de Gallia&et les milices ont travaill< en tandem pour&reprendre Fouzen, Dieseehl et Janluc &simultan<ment. Les membres survivants de la&d<fense de l'Empire ont <t< vus faire retraite&en masse du nord alors que l'arm<e Gallienne a;;
6096;37428;307;;mission, Operation White Steed. As they hunt&down those stragglers, northern Gallia is now&all but completely free of Imperial influence.&Just as the loss of the industrial centers had&meant a heavy drain on its finances, their&liberation is now expected to act as a shot&in the arm for the Gallian economy.;commenc< sa mission recherche et destruction,&l'op<ration Cheval Blanc.Alors qu'ils traquent&ces trainards, le nord de Gallia est&maintenant quasi libre de toute influence&imp<riale. Tout comme la perte des centres&industriels a entrain< une forte ponction sur&ses finances, leur lib<ration devrait&agir comme un coup de fouet pour l'<conomie.;;
6112;37740;342;;Books on the Valkyrian legend are selling in&record numbers of late, according to a recent&Gallian Literary Review survey, titles that&promise the truth behind the mystery of the&ancient tribe are enjoying special success.&The Valkyria myth has ties today to religion&and history alike and lends base material to&any number of popular novels.;Les livres sur la l<gende Valkyrian se vendent&en nombre record derni>rement, selon un r<cent&sondage Gallian Literary Review,les titres qui&promettent la v<rit< sur les myst>res de&l'ancienne tribu connaissent le succ>s.&Le mythe Valkyria tisse des liens aujourd'hui&avec la religion et l'histoire et il est la&mati>re de base de nombreux romans populaires.;;
6128;38088;361;;The reason for this sudden boom may well lie&in the uncertainties of a nation at war. One&poll recently confirms the common-sense notion&that in times of peril, people are more likely&to turn to religion to pray for salvation.&Recent claims of a Valkyria working for the&Imperial army, still believed spurious, are no&doubt also helping to push the trend along.;La raison de ce boom soudain pourrait r<sider&dans les incertitudes d'une nation en guerre.&Un sondage confirme la notion de bon sens qui&veut qu'en temps de p<ril, les gens sont plus&enclins = se tourner vers la religion.&L'affirmation qu'une Valkyria travaille pour&l'arm<e imp<riale, simulation ou pas, a sans &aucun doute contribu< = cette tendance.;;
6144;38456;371;;After a heated struggle, the 3rd Regiment took&the sanguine shore of Marberry, the Empire's&final holding in northern Gallia. Surrounded&by sheer cliffs, Marberry is a natural citadel&that has proved impossible to fell in previous&bids staged by the Gallian Army. The militia's&strategy hinged upon a newly developed form of&smokescreen grenade to mask their approach and;Apr>s une apre lutte, le 3e R<giment a pris la&rive de Marberry, le dernier bastion Imp<rial&du nord de Gallia. Entour< par d'abruptes&falaises, Marberry est une citadelle naturelle&qu'il s'etait av<r< impossible = abattre pour&l'arm<e de Gallia. La strat<gie de la milice,&articul< autour d'une grenade fumig>ne&nouvellement d<velopp< pour masquer leur;;
6160;38832;358;;baffle Imperial gunmen. The inventor of those&life-saving grenades, Corp. Isara Gunther (16),&was a tank pilot for Squad 7 and promised to&be one of Gallia's great minds in engineering&until Imperial fire at the end of this mission&claimed her life. Her loss is a blow to the&nation, and to her squad, who saw her buried&in the War Cemetery near the capital.;approche et d<router l'infanterie imp<riale.&L'inventeur de ces grenades sauveuse de vie,&Capo. Isara Gunther (16), <tait promise = $tre&l'un des grands esprits dans l'ing<nierie mais&un tir Imp<rial a fauch< sa vie = la fin de&cette mission. Sa perte est un coup dur pour&la nation et l'Escouade7, qui la vit enterr< &dans le Cimeti>re de Guerre de la capitale.;;
6176;39196;355;;As EWII continues to expand in intensity and&scale, the number of war orphans has climbed&to new record highs. According to a recent&study by EWORF (the Europan War Orphan Rescue&Fund, an NGO), the number of children who have&lost parents is rivaled only by the number who &have lost access to educational facilities &despite an expressed desire to learn.;Comme EWII continue de s'aggraver, le nombre&d'orphelins de guerre a grimp< = de nouveaux&records. Selon une <tude r<cente men<e par&EWORF (le Fonds de sauvetage des Orphelins&de Guerre d'Europa, une ONG), le nombre&d'enfants qui ont perdu leurs parents n'a&d'<gal que le nombre qui ont perdu l'acc>s =&l'<cole, malgr< leur d<sir d'apprendre.;;
6192;39556;365;;Gallia is no exception to this continent-wide&trend, though its Parliament voiced plans for&securing basic education and job training in a&recent session. EWORF has approached leaders&from each of Europa's nations, calling for the&establishment not just of orphanages, but of a&full infrastructure to support these children&as they grow into self-supporting adults.;Gallia ne fait pas exception = cette tendance&= l'<chelle du continent,bien que le Parlement&ait fait des plans pour assurer l'<ducation et&les formations aux emplois. EWORF a approch<&les dirigeants de chacune des nations d'Europa&,appelant = la mise en place non seulement des&orphelinats, mais l'infrastructure compl>te&apte = assurer le futur de ces enfants.;;
6208;39928;361;;A recent release from Gallia's central forces&confirmed that the border town of Bruhl was&successfully taken from Imperial control.&The armies of Gallia and the Empire now stand&face-to-face along the massive Naggiar plains,&braced for a direct and all-out clash. Bruhl&represents a key Imperial supply route, making&this militia win one with repercussions that;Un r<cent communiqu< des forces de Gallia a&confirm< que la ville frontali>re de Bruhl a&<t< reprise avec succ>s. Les arm<es de Gallia&et l'Empire se tiennent d<sormais face-=-face&dans les <normes plaines de Naggiar,fortifi<es&pour un affrontement massif.Bruhl repr<sentait&une ligne d'approvisionnement Imperial&essentielle, ce qui fait que cette victoire de;;
6224;40296;308;;extend far beyond this small border town.&In a remarkable coincidence, the officer who&led the Bruhl operation and leader of the&militia's Squad 7, Welkin Gunther (22), is a&Bruhl native himself. He returned to claim&his town from the Empire after being ousted by&their original invasion over six months ago.;la milice a des r<percussions qui s'<tend bien&au-del= de cette petite ville frontali>re.&Coincidence remarquable, l'officier qui a&dirig< l'op<ration Bruhl le leader d'Escouade&, Welkin Gunther (22), est un natif Bruhl lui&m$me. Il est retourn< reprendre sa ville =&l'Empire apr>s en avoir <t< <vinc< par leur&invasion d'origine il y a plus de six mois.;;
6240;40612;361;;Randgriz National University Department of&Archeology reported a theft from its archives&on the 15th. The objects in question are two&artifacts of unknown age unearthed last year&from a university dig site in Barious, and are&said to contain exceptionally pure ragnite.&Though their creation likely predates written&history, their shapes bear strong resemblance;Le D<partement d'Arch<ologie de l'Universit<&Nationale de Randgriz a signal< un vol dans&ses archives le 15.Les objets en question sont&2 objets d'age inconnu d<couverts l'ann<e&derni>re lors d'une fouille universitaire sur&le site de Barious, et que l'on dit contenir&du ragnite d'une puret< exceptionnelle. Bien&que leur cr<ation soit susceptible d'$tre;;
6256;40980;302;;to the lance and shield spoken of in the myth&of the Valkyrur. Whether these were truly used&by the warriors of legend or whether they bore&ceremonial significance remains unclear.&An investigation into who was behind the&missing items is currently underway, but no&leads have surfaced at present time.;ant<rieure = histoire <crite, leurs formes&ressemblent beaucoup aux lance et boucliers&mentionn<s dans le mythe des Valkyrur. Que&ceux-ci aient <t< utilis<s par les guerriers&de l<gende ou n'avaient qu'une importance&c<r<monielle reste incertain. Une enqu$te sur&l'auteur de ce vol est en cours, mais aucune&piste n'est privil<gi<e = l'heure actuelle.;;
6272;41288;365;;The Gallian Army engaged the Empire at Naggiar&on the 20th in the start of what promises to be&an all-out confrontation. The opposing armies&combine to number several tens of thousands as&both nations' principal forces clash. Details&from the battlefield are still sparse, but our&investigation shows that the offensive&launched against the Empire's right flank was;L'arm<e de Gallia a engag< l'Empire = Naggiar&le 20 dans le d<but de ce qui promet d'$tre&une confrontation totale. Les arm<es oppos<es&se combinent pour un effectif de plusieurs&dizaines de milliers pour une confrontation&des forces principale des deux nations.&Les d<tails du champ de bataille sont encore&rares, mais notre enqu$te montre que;;
6288;41660;297;;completely wiped out by armored units led by&Imperial Gen. Selvaria Bles. Bles, said to be&descended from the ancient Valkyrur, has&single-handedly defeated every squad Gallia&has sent her way since the hostilities at&Naggiar began. The Gallian Army has yet to&officially comment on the situation.;l'offensive lanc<e contre le flanc droit de&l'Empire a <t< compl>tement an<antie par des&unit<s blind<es men<es par le g<n<ral Imperial&Selvaria Bles. Bles, que l'on dit descendante&des Valkyrur, a = elle seule battu toutes les&Escouade que Gallia a envoy< sur son chemin&depuis le d<but des hostilit<s. L'arm<e n'a&fait aucun commentaire sur la situation.;;
