3792;17944;89;;BUT! Don't go tryin' to hog all the glory!&A squad's a team and we got no need for stars!;MAIS! N'essayer pas de vous accaparer toute la gloire! Une&escouade est une <quipe et nous n'avons pas besoin de stars!;;
3808;18040;92;;"You'll train as a class and level up by class.&""Scout Level 2,"" ""Scout Level 3,"" you get it?";Vous vous entrainez et prenez les niveaux par classe.&Niveau Eclaireur 2, Niveau Eclaireur 3, vous avez compris?;;
3824;18140;82;;When the scouts level up, that means each and&every one of 'em goes up that level.;Lorsque les Eclaireurs montent de niveau,&cela signifie que chacun d'eux montent ce niveau.;;
3840;18228;91;;You hear me, maggots? Any of you thinks he's&better than the rest of the team, go home now!;Vous m'entendez, asticots? Ceux d'entre vous qui se pensent&meilleurs que les autres, rentrez = la maison maintenant!;;
3856;18324;74;;All right. Now I'll show you lowlifes how&this whole thing actually works.;Bien. Maintenant, je vais montrer = vos petites natures&comment tout cela fonctionne r<ellement.;;
3872;18404;92;;It ain't complicated. First you go out there and fight,&then divvy up that experience here. ;Ce n'est pas compliqu<. D'abord, vous sortez dehors et&combattez, puis nous distribuerons cette exp<rience ici.;;
3888;18504;86;;Once the experience you cram into a soldier&class clears a set amount, it'll level up.;Une fois que l'exp<rience que vous mettez dans une classe&de soldat arrive = un seuil, elle va monter de niveau.;;
3904;18596;92;;Pickin' which class to level up and when is your&job as the squad leader! Now, give it a go!;Choisir quelle classe doit monter de niveau et quand est&votre travail de chef d'escouade! Maintenant, commencons!;;
3920;18696;90;;Got it? That's how trainin' by class works.&Now get out there and rack up some experience!;Compris? Voil= comment l'entrainement par classes fonctionne&Maintenant sortez et accumulez de l'exp<rience!;;
3936;18792;38;;Oh, and there's one more thing to add.;Oh, et il y a encore une chose = ajouter.;;
3952;18836;73;;Sometimes levelin' up a unit class will&unlock a hidden potential in 'em.;Parfois le changement de niveau d'une classe&permet de d<bloquer un potentiel cach< en eux.;;
3968;18916;83;;You can think of potentials as the natural&abilities your soldiers have inside 'em.;Vous pouvez voir les potentiels comme&une capacit< naturelle que vos soldats avaient en eux.;;
3984;19004;88;;Those abilities will form a big part of your&strength in the field, so keep 'em in mind!;Ces capacit<s constitueront une grande partie de&votre force sur le terrain, donc gardez-le = l'esprit!;;
4000;19100;73;;Other times, levelin' up a class will earn you&clearance for a new order.;D'autres fois, la mont< d'une classe vous fera&gagner un permis d'utiliser un nouvel ordre.;;
4016;19180;89;;Here, as long as we're talkin' about it...&I'll teach you a classic. A real golden oldie.;Tiens, vu que l'on parle de cela ... Je vais vous&apprendre un classique. Un vieux de la vielle en or.;;
4032;19276;86;;You learned @fcfff00000:Evade Boost@fci:.&This order raises one ally's evasion&skills.;Vous avez appris @fcfff00000: Boost Esquive@fci:.&Cet ordre augmente les comp<tences&d'<vasion d'un alli<.;;
4048;19368;81;;Use this order in command mode to boost the&entire squad's evasion for one phase.;Utilisez cet ordre en mode de commande&pour augmenter l'esquive de toute l'<quipe pour une phase.;;
4064;19456;90;;Orders are special commands you can give out&as the squad leader. They can save your tail!;Les ordres sont des commandes sp<ciales que&vous pouvez donner. Ils peuvent vous sauver la peau!;;
4080;19552;101;;It doesn't take a genius to see that levelin' up&your soldiers is the best way to beef up your squad.;Il ne faut pas $tre un g<nie pour voir qu'am<liorer vos&soldats est la meilleure facon de renforcer votre escouade.;;
4096;19660;84;;The soldiers will get stronger, and you just might&unlock new potentials and orders.;Les soldats seront plus forts, et vous pourrez d<bloquer&de nouveaux potentiels et des ordres.;;
4112;19752;60;;All that,&just from me workin' you sorry bums into the dirt!;Tout cela, grace = moi trainant les limaces d<sol<es&que vous $tes dans la salet<!;;
4128;19820;82;;I just hope you maggots are ready for a REAL&workout the next time I see you here!;J'esp>re juste que vous, les asticots, seraient pr$t&pour une VRAIE s<ance d'entrainement la prochaine fois.;;
4144;19908;41;;Welcome to your worst nightmare, maggots!;Bienvenue dans votre pire cauchemar, asticots!;;
4160;19956;41;;Come back any time you're ready to sweat!;Revenez quand vous serez pr$t = transpirer!;;
4176;20004;93;;Congratulations. You soldiers worked long and hard&to become what you are today: true elites.;F<licitations. Vous avez boss< longtemps et durement&pour devenir ce que vous $tes d<sormais: de vraies <lites.;;
4192;20104;94;;As Gallia's finest, you're all fit to be called heroes.&Her Highness even has a medal for you.;Comme fine fleur de Gallia, vous pouvez tous $tre&appel<s h<ros. Son Altesse a m$me une m<daille pour vous.;;
4208;20204;95;;Lieutenant Gunther, you shared in your soldiers' struggles.&Now you've brought up a fine squad.;Lieutenant Gunther, vous avez partag< les combats de vos&soldats. Maintenant vous avez d<velopp< une fine <quipe.;;
4224;20304;86;;I tell ya, you're one fast learner.&You've mastered a lot of what it takes to command.;Je vous le dis, vous comprenez vite.&Vous avez maitris< beaucoup de ce qu'il faut pour commander.;;
4240;20396;85;;I take no small amount of pride in having&trained you soldiers these last few months.;Je ne suis pas peu fier de vous avoir&entrain< ces derniers mois.;;
4256;20488;89;;Now I join the rest of Gallia in asking you&all to go out there and fight for our future.;Maintenant, je me joins au reste de Gallia en demandant = vous tous de sortir et de vous battre pour notre avenir.;;
4272;20584;87;;Unlike the rest of Gallia, I've seen what&you soldiers can do. I will be sleeping easy.;Contrairement au reste de Gallia, j'ai vu ce que vous,&soldats, pouvez faire. Je vais pouvoir dormir tranquille.;;
4288;20676;60;;All glory be to Gallia!&May the Valkyrur keep you, soldiers!;Toute la gloire va = Gallia!&Que les Valkyrur vous gardent, soldats!;;
4304;20744;86;;And know that if you do lose out there,&I'll be waitin' here to kick your sorry tails!;Et je sais que si vous perdez l=-bas,&je serais ici pour vous tanner le cuir!;;
4320;20836;79;;You soldiers have no more business here.&Get out there and make some headlines.;Vous, soldats,  n'avez plus rien = faire ici.&Sortez et faites quelques gros titres.;;
4336;20920;73;;What, are you pansies missin' me?&Here to train for old times' sake? Eh?!;Quoi, vous avez pens<es que vous m' manquiez?&Ici pour s'entrainer comme au bon vieux temps? Eh ?!;;
4352;21000;90;;I hear good things, soldiers! Very good things!&Keep fightin' the good fight. I'll see ya!;J'ai eu de bon retour, soldats! De tr>s bonnes choses!&Continuez = combattre en un beau combat. Je vous surveille!;;
4368;21096;36;;Train all you want! I got allll day!;Entrainez-vous tant que vous le voulez!&J'ai touuute la journ<e!;;
4384;21140;34;;Bite the bullet! No pain, no gain!;Serrer les dents! Pas de peine, pas de gain!;;
4400;21180;44;;I got no use for tears! Sweat, sweat, sweat!;Je n'ai pas d'utilit< pour les larmes! Sueur, sueur, sueur!;;
4416;21232;43;;You're better than this! Push those limits!;Vous valez mieux que cela! Poussez ces limites!;;
4432;21280;53;;Good work, maggots!&You're one level closer to human!;Bon travail, asticots!&Vous $tes un niveau plus proche des humains!;;
4448;21340;70;;Looks like that session beat a new potential&out of the shocktroopers!;On dirait que cette session a r<v<l<&un nouveau potentiel chez les commandos!;;
4464;21416;63;;Looks like that session beat a new potential&out of the scouts!;On dirait que cette session a r<v<l<&un nouveau potentiel sur les <claireurs!;;
4480;21484;64;;Looks like that session beat a new potential&out of the lancers!;On dirait que cette session a r<v<l<&un nouveau potentiel sur les lanciers!;;
4496;21556;66;;Looks like that session beat a new potential&out of the engineers!;On dirait que cette session a r<v<l<&un nouveau potentiel sur les ing<nieurs!;;
4512;21628;64;;Looks like that session beat a new potential&out of the snipers!;On dirait que cette session a r<v<l<&un nouveau potentiel sur les snipers!;;
4528;21700;60;;Congratulations, shocktroopers!&As of today, you are Elites!;F<licitations, commandos!&A compter d'aujourd'hui, vous $tes <lites!;;
4544;21768;39;;That means clearance for flamethrowers!;Cela signifie avoir acc>s aux lance-flammes!;;
4560;21812;53;;Congratulations, scouts!&As of today, you are Elites!;F<licitations, <claireurs!&A compter d'aujourd'hui, vous $tes <lites!;;
4576;21872;40;;That means clearance for rifle grenades!;Cela signifie avoir acc>s lance-grenades!;;
4592;21920;54;;Congratulations, lancers!&As of today, you are Elites!;F<licitations, lanciers!&A compter d'aujourd'hui, vous $tes <lites!;;
4608;21980;56;;Congratulations, engineers!&As of today, you are Elites!;F<licitations, ing<nieurs!&A compter d'aujourd'hui, vous $tes <lites!;;
4624;22044;40;;That means clearance for rifle grenades!;Cela signifie avoir acc>s lance-grenades!;;
4640;22092;54;;Congratulations, snipers!&As of today, you are Elites!;F<licitations, snipers!&A compter d'aujourd'hui, vous $tes <lites!;;
4656;22152;76;;Okay, you've earned clearance for a new order!&Put it to good use out there!;Okay, vous avez gagn< l'acc>s = un nouvel ordre!&Mettez-le = profit l=-bas!;;
4672;22236;43;;Welcome to R&D, man.&What can I do you for?;Bienvenue en R£D, man(homme).&Que puis-je faire pour vous?;;
4688;22284;70;;Huh? Wait, I know that insignia!&You're Lieutenant Gunther, aren't ya?;Hein? Attendez, je connais cet insigne!&Tu es le lieutenant Gunther, n'est-ce pas?;;
4704;22360;79;;I knew it! Man, I've heard about you!&That evacuation at Bruhl was just... WOW!;Je le savais! Man, j'ai entendu parler de toi!&Que l'<vacuation = Bruhl <tait juste ... WOW!;;
4720;22444;74;;Protecting a tiny life in the middle of&all that slaughter... Man... MAN! ;Prot<ger une vie minuscule au milieu&de tout ce massacre ... Man ... MAN!;;
4736;22524;74;;Lieutenant, you're good people!&You get all my respect and then some, bro!;Lieutenant, tu es un homme bien!&Tu as tout mon respect et tout, bro(fr<rot)!;;
4752;22604;71;;What's going on, Leon?&I could hear you from clear across the hangar...;Qu'est-ce qui se passe, Leon?&Je peux t'entendre de l'autre bout du hangar ...;;
4768;22680;65;;Oh! KC, check it out!&It's Lieutenant Gunther! He's the MAN, man!;Oh! KC, regarde bien!&C'est le lieutenant Gunther! Il est le MAN, man!;;
4784;22752;76;;Ha ha! Sorry about him, Lieutenant.&He's like this all the time, I'm afraid.;Ha ha! D<sol< pour lui, lieutenant.&Il est comme ca tout le temps, j'en ai peur.;;
4800;22836;77;;But where are my manners? I'm Kreis Czherny.&I'm training here as a mechanic.;Mais ou sont mes mani>res? Je suis Kreis Czherny.&Je m'entraine ici comme m<canicien.;;
4816;22920;71;;Oh! Oh! And I'm Leon Schmidt, but just call me Leon, bro!&I'm your boy!;Oh! Oh! Et je suis Leon Schmidt, mais appelle-moi Leon, bro!&Je suis ton servant!;;
4832;22996;58;;So, Lieutenant Gunther, what brings you down to R&D today?;Donc, lieutenant Gunther, qu'est-ce qui vous am>ne en R£D&aujourd'hui?;;
4848;23060;78;;We do work here on weapons development,&making upgraded weapons and equipment.;Nous travaillons ici sur le d<veloppement d'armes,&l'am<lioration d'armes et d'<quipement.;;
4864;23144;73;;And that includes rifles and machine guns.&We can even soup up your tank!;Et cela inclut fusils et mitrailleuses.&Nous pouvons m$me tuner votre char!;;
4880;23224;44;;Of course, research expenses aren't cheap...;Bien sur, les frais de recherche ne sont pas gratuits...;;
4896;23276;83;;With rifles and other firearms,&we'll mass-produce new models as they're developed.;Avec les fusils et les autres armes = feu, nous produirons&en masse les nouveaux mod>les une fois d<velopp<s.;;
4912;23364;78;;You won't have to worry about making&enough for your squad. We'll outfit them.;Vous n'aurez pas = vous soucier d'en faire assez&pour votre <quipe. Nous les <quipons tous.;;
4928;23448;71;;For tanks, you can upgrade the baseline&performance of the body itself,;Pour les chars, vous pouvez am<liorer les performances de&base du corps lui-m$me,;;
4944;23524;69;;or develop optional parts that you can add&on to tweak out its specs!;ou d<velopper des pi>ces optionnelles que vous pourrez&ajouter pour modifier ses sp<cifications!;;
4960;23600;82;;Right, you can choose which optional parts&you want in the Tank Equipment section.;Bien, vous pouvez choisir la pi>ce optionnelle que vous&voulez dans la section Equipment de Char.;;
4976;23688;82;;Come in any time and make adjustments based&on the needs of the operation at hand.;Venez quand vous voulez faire des ajustements en fonction&des besoins de l'op<ration en cours.;;
4992;23776;28;;Well, sir? Was that helpful?;Eh bien, monsieur? Cela a <t< utile?;;
5008;23812;88;;We're working here around the clock to make&possible tomorrow what's out of reach today.;Nous travaillons ici tout le temps pour rendre possible&demain ce qui est hors de port<e aujourd'hui.;;
5024;23908;86;;Come again a little later. We'll do our best&to have something useful for you by then.;Revenez un peu plus tard. Nous ferons de notre mieux&pour avoir quelque chose d'utile pour vous d'ici l=.;;
5040;24000;83;;Yeah, you'd better come back soon, bro!&I am all fired up to work on stuff for you!;Ouais, tu ferais mieux de revenir bientot, bro! Je suis&chaud bouillant de travailler sur des trucs pour vous!;;
5056;24088;64;;Welkin, bro! I'm stoked you're here, man!&What can I do you for?;Welkin, bro! Je suis content que tu sois l=, man!&Que puis-je faire pour toi?;;
5072;24160;35;;Sorry, bro... Just not there yet...;D<sol<, bro... Encore rien l= ...;;
5088;24200;26;;Here ya go, bro! All done!;Et voil=, bro! Tout fini!;;
5104;24232;41;;Phew, it's done! This one's perfect, bro!;Ouf, c'est fini! Celui-ci est parfait, bro!;;
5120;24280;31;;All set for ya, bro! It's done!;Tout est r<gl< pour toi, Bro! C'est fait!;;
5136;24316;42;;Come back again soon, bro!&I mean it, man!;Revient bientot, bro! Je veux dire,man!;;
5152;24364;768;; &          About Outfitting Tanks& &Development work on tanks happens in the&form of body enhancements, tread and weak&point improvements, and attack support.&Body enhancements mostly reinforce the gun&barrel and body armor to improve its base&stats.&Tanks will automatically be given&the best body type you have developed.& &You decide whether to favor attack or&defense, and altering body types gives your&tank a different outward appearance.&Improvements to the treads and weak point&and attack support take the form of parts&that can be added to tanks to enhance&their abilities.&Each part has a set size in blocks.& &You decide how to fill the 4x3&block storage capacity in the Edelweiss.& &Pick the optional parts that best fit your&own personal combat style.& ; &  A propos des modifications de chars& &Le travail de d<veloppement sur les chars&se passe sous la forme d'am<lioration du&corps, des chenilles, am<lioration sur&les points faibles et capacit< d'attaque.&L'am<lioration du corps du char renforce&essentiellement la tourelle du canon et&l'armure du corps pour am<liorer ses&statistiques de base.&Les chars auront automatiquement le&meilleur type de corps que vous avez&d<velopp<.&Vous d<cidez cependant de favoriser&l'attaque ou la d<fense,&et la modification du type de corps donne&une apparence diff<rente = votre char.&Les am<liorations apport<es aux chenilles&, point faible et capacit< d'attaque&prennent la forme de pi>ces qui peuvent&$tre ajout<s aux chars afin de renforcer&leurs capacit<s.&Chaque pi>ce a une taille donn<e de bloc.&Vous d<ciderez comment remplir la&capacit< de stockage en blocs&4x3 de l'Edelweiss.&Choisissez les pi>ces optionnelles qui&correspondent au mieux = votre propre&style de combat personnel.;;
5168;25140;34;;Heyyy, Lieutenant! Off duty today?;Heyyy, lieutenant! Au repos aujourd'hui?;;
5184;25180;94;;Your timing's perfect! There's something I want to show you.&Won't take but a minute. Come on!;Pile au bon moment! Il ya quelque chose que je&veux te montrer. Cela ne prendra qu'une minute. Vient!;;
5200;25280;76;;Ta daaa! It's the Writing on the Wall,&written and published by yours truly!;Ta daaa! C'est Les Nouvelles sur le Mur,&<crit et publi< par votre serviteur!;;
5216;25364;63;;Hmm? Why do this when I already have a radio news gig,&you say?;Hmm? Pourquoi faire cela alors que j'ai d<j=&une <mission de nouvelles = la radio, tu te dis?;;
5232;25432;110;;Sure, I could leave it up to the print news guys, but&they're all lap dogs. The government censors everything.;Bien sur, je pourrais laisser imprimer ca = la presse, mais&ce sont tous des l>ches bottes.Le gouvernement censure tout.;Bien sur, je pourrais laisser imprimer ca = la presse, mais&;ce sont tous des l>ches bottes.Le gouvernement censure tout.
5248;25548;114;;And not just a little cut here and there. In some cases,&they'll bend the harsh truth into candy-sweet propaganda.;Et pas seulement une petite coupure ici et l=. Dans certains&cas, ils vont plier la dure v<rit< en propagande mielleuse.;Et pas seulement une petite coupure ici et l=. Dans certains;&cas, ils vont plier la dure v<rit< en propagande mielleuse.
5264;25668;91;;I'm sooo sick of it. I want to give my readers the truth!&That includes the bad stuff, too.;Je suis tellement malade de cela. Je veux donner = mes&lecteurs la v<rit<! Cela inclut les mauvaises choses, aussi.;Je suis tellement malade de cela. Je veux donner = mes&lecte;lecteurs la v<rit<! Cela inclut les mauvaises choses, aussi.
5280;25764;54;;So this is my brilliant plan! The Writing on the Wall.;Donc, c'est mon plan g<nial! Les Nouvelles sur le Mur.;Donc, c'est mon plan g<nial! Les Nouvelles sur le Mur.;Donc, c'est mon plan g<nial! Les Nouvelles sur le Mur.
5296;25824;106;;Some things are only possible in out-of-the-way spots&like this, out of sight from those government goons.;Certaines choses ne sont possibles que dans des endroits =&l'<cart, hors de vue des hommes de main du gouvernement.;Certaines choses ne sont possibles que dans des endroits =&l;s =&l'<cart, hors de vue des hommes de main du gouvernement.
5312;25936;84;;I'll keep this space filled with up-to-date,&absolutely factual info. No censorship!;Je vais garder cet espace rempli avec des nouvelles,&infos absolument factuelles. Aucune censure!;;
5328;26028;92;;And your exploits will feature heavily, I'm sure!&So yeah, come by and have a read sometime!;Et vos exploits en seront lourdement la vedette, j'en suis&sur! Donc oui, revient y jeter un oeil de temps en temps!;;
5344;26128;24;;And while you're here...;Et pendant que tu es l=...;;
5360;26160;85;;I want to put a book out someday, right?&To put the truth in the hands of the people!;Je veux y sortir un livre certains jours?&Pour mettre la v<rit< dans les mains du peuple!;;
5376;26252;94;;But I'm just a radio news grunt, you know?&I'll be paying for everything out of my own pocket.;Mais je suis juste une newseuse pour la radio, tu sais?&Je vais payer pour tout de ma propre poche.;;
5392;26352;103;;Sooo, I figured I'd ask you. Think you could find it in&your wallet's heart to help a girl get started?;Alooors, j'ai pens< que je pouvais te demander.Penses-tu que&tu puisses avoir = coeur d'aider une jeune fille = d<buter?;;
5408;26460;74;;I'd make it worth your while! &You guys could feature in the book I write!;Je le ferais valoir le coup!&Vous, les gars, pourrez figurer dans le livre que j'<cris!;;
5424;26540;91;;I still haven't decided what all I want to put in it,&but I promise it'll be all about you!;Je n'ai pas encore d<cid< de tout ce que je veux y mettre,&mais je te promets que ca va $tre surtout sur vous!;;
5440;26636;64;;See this fat stack of notes?&I've got a ton of material already!;Tu vois cette grosse pile de notes?&J'ai une tonne de mat<riel d<j=!;;
5456;26708;90;;So, how about it? Call it an investment in the future&rising star of authordom! Pleeease?!;Alors, t'en pense quoi? Appelle cela un investissement sur&l'avenir de l'<toile montante des <crivains! S'il te plait?!;;
5472;26804;82;;I plan on putting out new editions periodically,&so drop by to check it out often.;J'ai l'intention de mettre de nouvelles <ditions&p<riodiquement, alors pense = v<rifier souvent.;;
5488;26892;98;;Especially after you've made some headlines on the&battlefield. That's the perfect time to strike!;Surtout apr>s que vous ayez fait quelques gros titres sur&le champ de bataille. C'est le moment id<al pour frapper!;;
5504;26996;92;;I'm counting on you out there, Welkin! &You need to keep me supplied with exciting material!;Je compte sur vous l=-bas, Welkin!&Vous devez me garder aliment<e en mati>re excitante!;;
5520;27096;70;;Heyyy! Dropping by to read the Writing on the Wall?&That's a good man!;Heyyy! Surpris en train de lire Les Nouvelles sur le Mur?&C'est un homme bien!;;
5536;27172;103;;Oh, and how about the new rising star of Squad 7, huh?&I've heard some wild stories! You must be proud.;Oh, comment va la nouvelle <toile montante de l'Escouade 7,&hein?J'ai entendu des histoires folles!Tu dois en $tre fier.;;
5552;27280;104;;I couldn't help but snipe 'em with a pop interview!&You'll have to read it once I get it all drafted up!;Je n'ai pas pu m'emp$cher de les frapper d'un interview sur-&prise! Tu pourras le lire d>s que j'aurais fini de l'<crire!;;
5568;27392;69;;So... Come to make a donation to the Get Ellet's Name&On A Book Fund?;Alors ... Venant faire un don = la&fondation Avoir le Nom d'Ellet Sur Un Livre?;;
5584;27468;27;;Ha ha ha! Thanks a million!;Ha ha ha! Un million de merci!;;
5600;27500;35;;Ta dada daa!&I've got new material!;Ta dada daa!&J'ai du nouveau en stock!;;
5616;27540;78;;Come back and see the Writing on the Wall again soon!&I'll be waiting for you!;Revenez voir encore Les Nouvelles sur le Mur bientot!&Je vous y attendrai!;;
5632;27624;363;;In an interview given on the 8th, a spokesman&for the central Gallian armed forces suggested&a massive anti-Imperial counterstrike brewing.&Should this come to pass, all eyes will be on&how a force that has thus far specialized in&retreat can stem the Imperial incursion that&claimed most of Gallia by last month's end&and now stands before the gates of Randgriz.;Dans une interview du 8, un porte-parole des&forces arm<es de Gallia a sugg<r< qu'une&contre-attaque massive <tait en maturation.&Si cela arrive, tous les yeux seront riv<s sur&la facon qu'une force, qui parait sp<cialis<e&dans la retraite, pourra endiguer l'incursion& imp<riale qui a pris une bonne partie de&Gallia = la fin du mois dernier et se situe;;
5648;27992;301;;It seems the militia will join the army proper&on this bid to free the capital from a siege,&a fear that has persisted for weeks now. Some&suggest that this move is due to the army's&desire to conserve its own manpower for combat&within the city's walls, a very real&possibility should this plan fail.;maintenant devant les portes de Randgriz.&Il semble que la milice se joindra = l'arm<e&pour cette tentative de lib<rer la capitale&d'un si>ge, crainte qui a persist< depuis des&semaines. Certains sugg>rent que ce mouvement&est du = la volont< de l'arm<e de conserver sa&puissance pour un combat = l'int<rieur de la&ville, l'<chec <tant probable.;;
5664;28300;363;;The Empire-owned and run Tares news outlet&reported on the 6th that Imperial forces have&claimed the coastal Federation city of Valua.&If true, the Empire would now hold a supply&route for ragnite transit, greatly influencing&their standing in southern Europa. Unlike the&northern provinces, Europa's south lacks for&ragnite, meaning that supplies must be shipped;Les nouvelles sorties dans Tares d<tenu par&l'Empire rapportent le 6 que les forces&Imp<riales ont captur< la ville coti>re&Valua de la F<d<ration. Si c'est vrai,&l'Empire aurait une route d'approvisionnement&en ragnite ,influencant grandement leur&situation dans le sud d'Europa. Contrairement&aux provinces du nord, le sud de l'Europa;;
5680;28668;302;;in from elsewhere to sustain the Empire's&offensive. The Empire's hold on Europa's&southern coast means expansion of the conflict&to all areas of the continent is more likely&now than ever before. The Federation has yet&to issue a statement regarding the Empire's&alleged seizure of Valua at this time.;manque de  ragnite, et donc que les&fournitures doivent venir d'ailleurs pour&soutenir l'offensive de l'Empire. Leur emprise&sur la cote sud d'Europa signifiant qu'une&expansion du conflit = tout le continent est&plus probable que jamais. La F<d<ration n'a&encore rien dit au sujet de la pr<tendue &capture de Valua par l'Empire pour l'instant.;;
5696;28976;347;;Gallia's militia brings home the glory! As the&first operation in what is likely a full-scale&counteroffensive, the 3rd Regiment reclaimed&the Great Vasel Bridge, a vital trade artery,&after rousting the Empire's local defenses on&the 14th. This officially frees Randgriz from&the need to seal its walls.&Rather than assail the Empire's bridgehead;La milice de Gallia revient victorieuse! Dans&cette premi>re op<ration de contre-offensive =&grande <chelle, le 3e R<giment a r<cup<r< le&Grand Pont de Vasel, une art>re commerciale&vitale, apr>s avoir expuls< les d<fenses de&l'Empire le 14. Cela lib>re donc Randgriz de&la n<cessit< de sceller ses murs. Plutot que&d'assaillirent la barricade de la t$te de pont;;
