5632;41104;;under one rule in ancient times.;;under one rule in ancient times.
3424;41137;;unification under Valkyrur rule.;;unification under Valkyrur rule.
3936;41170;;units and 2,000 military police units in;;units and 2,000 military police units in
5824;41211;;units suited to Gallia's topography over;;units suited to Gallia's topography over
5752;41252;;until the Valkyrur defeated them in the;;until the Valkyrur defeated them in the
3932;41292;;up of 80,000 ground units, 10,000 marine;;up of 80,000 ground units, 10,000 marine
3900;41333;;uphold Gallia's position of neutrality.;;uphold Gallia's position of neutrality.
3868;41373;;upon enlistment.;;upon enlistment.
2688;41390;;use by Commander Maximilian and his top-;;use by Commander Maximilian and his top-
2096;41431;;using giant slabs of ragnite-rich stone;;using giant slabs of ragnite-rich stone
3436;41471;;vertical, horizontal and angled strokes;;vertical, horizontal and angled strokes
5100;41511;;vital ingredient to human civilization.;;vital ingredient to human civilization.
1612;41551;;war hero who founded it and began rule;;war hero who founded it and began rule
3300;41590;;war that dwarfed all those in memory.;;war that dwarfed all those in memory.
4140;41628;;was a major player in the arsenal's;;was a major player in the arsenal's
2788;41664;;was not long before the first campaigns;;was not long before the first campaigns
4984;41704;;was sealed away inside the central tower;;was sealed away inside the central tower
5112;41745;;weaponry derived from the ore has;;weaponry derived from the ore has
4816;41779;;were Europa's saviors, using that as a;;were Europa's saviors, using that as a
5532;41818;;were actually a powerful clan of Darcsen;;were actually a powerful clan of Darcsen
5972;41859;;were left to develop small ambush tanks,;;were left to develop small ambush tanks,
2860;41900;;when ragnite was discovered as a useful;;when ragnite was discovered as a useful
5060;41940;;when releasing the energy it contains.;;when releasing the energy it contains.
4188;41979;;when trench combat was the primary form;;when trench combat was the primary form
5976;42019;;which in turn led Imperial designers to;;which in turn led Imperial designers to
5748;42059;;which this race devastated the continent;;which this race devastated the continent
3276;42100;;with a formal declaration of war.;;with a formal declaration of war.
1824;42134;;with a unique accordion-fold design that;;with a unique accordion-fold design that
2388;42175;;with laborers. Hunting parties were sent;;with laborers. Hunting parties were sent
6048;42216;;with large cannons, and the development;;with large cannons, and the development
2272;42256;;with the evolution of ragnite science.;;with the evolution of ragnite science.
2812;42295;;with the small nations in their shadows;;with the small nations in their shadows
2780;42335;;within each of the kingdoms chose to;;within each of the kingdoms chose to
2900;42372;;within the alliance. The Empire retains;;within the alliance. The Empire retains
3824;42412;;won its independence, the law prescribes;;won its independence, the law prescribes
3056;42453;;year the Darcsen people were subdued and;;year the Darcsen people were subdued and
