4300;8067;;      Krimm N-246 46/45mm cannon;;      Krimm N-246 46/45mm cannon
4400;8100;;      Krimm N-520 20/122mm cannon;;      Krimm N-520 20/122mm cannon
4500;8134;;      Krimm N-6MX 130mm cannon x19;;      Krimm N-6MX 130mm cannon x19
4496;8169;;      Mustela 340mm cannon x2;;      Mustela 340mm cannon x2
4492;8199;;      Mustela 800mm cannon x2;;      Mustela 800mm cannon x2
4304;8229;;      Uranus 20mm tank machine gun x2;;      Uranus 20mm tank machine gun x2
4504;8267;;      Uranus 37mm machine cannon x12;;      Uranus 37mm machine cannon x12
4404;8304;;      Uranus 9mm tank machine gun x6;;      Uranus 9mm tank machine gun x6
4396;8341;;      Zabot 12/340mm cannon x2;;      Zabot 12/340mm cannon x2
3068;8372;;"BC or ""Before Conquest.""";;"BC or ""Before Conquest."""
4524;8399;;terrestrial dreadnought. Four engines;;terrestrial dreadnought. Four engines
2956;8439;;18th Century Industrial Revolution gave;;18th Century Industrial Revolution gave
3512;8479;;A common term for the systematic capture;;A common term for the systematic capture
2840;8520;;A conglomerate of nations united under;;A conglomerate of nations united under
2416;8559;;A high-voltage electric fence surrounded;;A high-voltage electric fence surrounded
3608;8600;;A longstanding tradition in Gallia, this;;A longstanding tradition in Gallia, this
4952;8641;;A massive lance-form weapon believed to;;A massive lance-form weapon believed to
5240;8681;;A perennial plant found across Gallia,;;A perennial plant found across Gallia,
3896;8720;;A standing self-defense force serves to;;A standing self-defense force serves to
5108;8760;;A surging need for tank fuel and;;A surging need for tank fuel and
5336;8793;;A winged cousin to the common pig, found;;A winged cousin to the common pig, found
5400;8834;;Affectionate and intelligent, they are;;Affectionate and intelligent, they are
2376;8873;;After capturing Fouzen, the Empire was;;After capturing Fouzen, the Empire was
2704;8912;;After claiming the citadel, the Empire;;After claiming the citadel, the Empire
4248;8951;;After the Empire employed highly mobile;;After the Empire employed highly mobile
4980;8991;;After the War of the Valkyrur, the spear;;After the War of the Valkyrur, the spear
1992;9032;;Allegedly scorched as a result of the;;Allegedly scorched as a result of the
2808;9070;;Alliance and the Atlantic Federation,;;Alliance and the Atlantic Federation,
2200;9108;;Along the outer wall, further writings;;Along the outer wall, further writings
1700;9147;;Amatriain, in honor of General;;Amatriain, in honor of General
1704;9178;;Amatriain, who was responsible for;;Amatriain, who was responsible for
1976;9213;;An arid desert devoid of all vegetation;;An arid desert devoid of all vegetation
4296;9253;;Arms: Mustela K5T10 280mm cannon;;Arms: Mustela K5T10 280mm cannon
4488;9286;;Arms: Valkof;;Arms: Valkof
4392;9299;;Arms: Zabot 18/340mm ragna-cannon;;Arms: Zabot 18/340mm ragna-cannon
5488;9333;;Army were repurposed to turn the plane's;;Army were repurposed to turn the plane's
5048;9374;;As Europa's primary energy source, this;;As Europa's primary energy source, this
2744;9414;;As a resource-rich part of the largest;;As a resource-rich part of the largest
5288;9453;;As an exceptionally hardy plant, they;;As an exceptionally hardy plant, they
3904;9491;;As every citizen receives basic military;;As every citizen receives basic military
2264;9532;;As one of Gallia's richest mining sites,;;As one of Gallia's richest mining sites,
5816;9573;;As part of a defensive force, Gallian;;As part of a defensive force, Gallian
4088;9611;;As the nation's only arms manufacturer,;;As the nation's only arms manufacturer,
2572;9651;;As the object of several border disputes;;As the object of several border disputes
4184;9692;;At the turn of the 20th Century, a time;;At the turn of the 20th Century, a time
2932;9732;;Atlantic Federation;;Atlantic Federation
2068;9752;;Barious Ruins Antechamber;;Barious Ruins Antechamber
2164;9778;;Barious Ruins Sanctum;;Barious Ruins Sanctum
2172;9800;;Barious Temple hides within it an inner;;Barious Temple hides within it an inner
4372;9840;;Batomys;;Batomys
4628;9848;;Because beliefs have traditionally taken;;Because beliefs have traditionally taken
4900;9889;;Because contact with a Valkyria triggers;;Because contact with a Valkyria triggers
3224;9930;;Beginning as an Imperial incursion into;;Beginning as an Imperial incursion into
5912;9970;;Born in the late 19th Century as a means;;Born in the late 19th Century as a means
4148;10011;;Brondel in skill. Brondel, who rose to;;Brondel in skill. Brondel, who rose to
1300;10050;;Bruhl;;Bruhl
5452;10056;;Built according to design notes left by;;Built according to design notes left by
4508;10096;;Built to Maximilian's specifications in;;Built to Maximilian's specifications in
3336;10136;;By circa 30 BC, the Darcsens are said to;;By circa 30 BC, the Darcsens are said to
2800;10177;;By the 1800's, the balance of power lay;;By the 1800's, the balance of power lay
5688;10217;;By the end of the 2nd Century after the;;By the end of the 2nd Century after the
3544;10257;;Captives were alternately used as slaves;;Captives were alternately used as slaves
1644;10298;;Castle Randgriz, home to the archduke,;;Castle Randgriz, home to the archduke,
3148;10337;;Century led to skyrocketing demand for;;Century led to skyrocketing demand for
1404;10376;;Century, when Castle Randgriz was built;;Century, when Castle Randgriz was built
3528;10416;;Continuing the long history of prejudice;;Continuing the long history of prejudice
2980;10457;;Councilor acts as the Federation's chief;;Councilor acts as the Federation's chief
2356;10498;;Darcsen Concentration Camp;;Darcsen Concentration Camp
3700;10525;;Darcsen Good-Luck Dolls;;Darcsen Good-Luck Dolls
2360;10549;;Darcsen laborers collected during;;Darcsen laborers collected during
3736;10583;;Darcsen pattern. Additional clothing and;;Darcsen pattern. Additional clothing and
4772;10624;;Darcsen population in unprovoked combat,;;Darcsen population in unprovoked combat,
3372;10665;;Darcsen rampage, they brought peace to;;Darcsen rampage, they brought peace to
5572;10704;;Darcsen traitors subsequently claimed to;;Darcsen traitors subsequently claimed to
5716;10745;;Darcsens;;Darcsens
2128;10754;;Decorated with a motif believed to be a;;Decorated with a motif believed to be a
5144;10794;;Depending on the refinery methods used,;;Depending on the refinery methods used,
1264;10834;;Despite its size of only 38,567 sq. km;;Despite its size of only 38,567 sq. km
5256;10873;;Distinguishing characteristics include;;Distinguishing characteristics include
3196;10912;;During the war, Gallia's military, led;;During the war, Gallia's military, led
2836;10951;;E Europan Imperial Alliance;;E Europan Imperial Alliance
3028;10979;;EC (Europan Calendar);;EC (Europan Calendar)
3052;11001;;Each year is counted in relation to the;;Each year is counted in relation to the
5844;11041;;Empire's invasion rather than squaring;;Empire's invasion rather than squaring
3816;11080;;Enacted as a way to enforce the position;;Enacted as a way to enforce the position
4276;11121;;Equus;;Equus
2740;11127;;Europa;;Europa
5500;11134;;Europa shortly before EWII, Gallia was;;Europa shortly before EWII, Gallia was
5092;11173;;Europa that its use began. Since the;;Europa that its use began. Since the
3060;11210;;Europa was united as a continent. Years;;Europa was united as a continent. Years
5920;11250;;Europa's first tanks were Imperial in;;Europa's first tanks were Imperial in
5720;11288;;Europa's oldest indigenous race, said to;;Europa's oldest indigenous race, said to
3376;11329;;Europa, according to inscriptions found;;Europa, according to inscriptions found
2868;11369;;Europa, pioneers in machine technology,;;Europa, pioneers in machine technology,
4320;11409;;Europan broad gauge rails, the entire;;Europan broad gauge rails, the entire
3444;11447;;Europans. Inscriptions on the monuments;;Europans. Inscriptions on the monuments
1752;11487;;Even R&D work on inventing new weaponry;;Even R&D work on inventing new weaponry
1376;11527;;Exports include dairy and bread made;;Exports include dairy and bread made
6004;11564;;Federation Tanks;;Federation Tanks
3228;11581;;Federation land, EWII quickly engulfed;;Federation land, EWII quickly engulfed
3268;11620;;Federation's border republics in quick;;Federation's border republics in quick
2552;11659;;Few areas within Gallia have been the;;Few areas within Gallia have been the
2672;11697;;Following EWI, it served as a checkpoint;;Following EWI, it served as a checkpoint
2332;11738;;Following the Empire's occupation, the;;Following the Empire's occupation, the
2260;11777;;Fouzen;;Fouzen
3128;11784;;Friction between Federation and Empire;;Friction between Federation and Empire
1208;11823;;Full of nature and rich in ragnite ore,;;Full of nature and rich in ragnite ore,
1212;11863;;Gallia borders the Empire to the east;;Gallia borders the Empire to the east
1548;11901;;Gallia enjoys a temperate oceanic;;Gallia enjoys a temperate oceanic
1504;11935;;Gallia is naturally fortified against;;Gallia is naturally fortified against
1396;11973;;Gallia's History;;Gallia's History
1492;11990;;Gallia's Topography;;Gallia's Topography
1236;12010;;Gallia. The first ruling ancestor of the;;Gallia. The first ruling ancestor of the
4084;12051;;Gallian National Arsenal;;Gallian National Arsenal
5812;12076;;Gallian Tanks;;Gallian Tanks
1848;12090;;Gallian capital and the outside world;;Gallian capital and the outside world
5860;12128;;Gallian engineers led by Professor;;Gallian engineers led by Professor
5348;12163;;Generally smaller than other porcines,;;Generally smaller than other porcines,
4476;12202;;Height:     35.8m    Weight:  16200t;;Height:     35.8m    Weight:  16200t
4284;12239;;Height:     5.69m   Weight: 288t;;Height:     5.69m   Weight: 288t
4380;12272;;Height:     8.17m  Weight:  245t;;Height:     8.17m  Weight:  245t
5436;12305;;Height:  3.7m     Weight: 0.46t;;Height:  3.7m     Weight: 0.46t
1520;12337;;Hilly plains cover sixty percent of the;;Hilly plains cover sixty percent of the
5744;12377;;"History tells of a ""Darcsen Calamity"" in";;"History tells of a ""Darcsen Calamity"" in"
5524;12418;;House Randgriz's Secret;;House Randgriz's Secret
4308;12442;;Imperial General Gregor personally aided;;Imperial General Gregor personally aided
5908;12483;;Imperial Tanks;;Imperial Tanks
6080;12498;;Imperial force by sheer numbers.;;Imperial force by sheer numbers.
3172;12531;;Imperial force employed a corps of newly;;Imperial force employed a corps of newly
2364;12572;;Imperial hunts were held in this Fouzen;;Imperial hunts were held in this Fouzen
5836;12612;;In EWI, the Gallian force used light;;In EWI, the Gallian force used light
3388;12649;;In addition to unifying the land under;;In addition to unifying the land under
2764;12688;;In ancient times, the Valkyrur managed;;In ancient times, the Valkyrur managed
4800;12727;;In order to justify their actions, the;;In order to justify their actions, the
5560;12766;;In return, the Valkyrur granted the clan;;In return, the Valkyrur granted the clan
5944;12807;;In the medieval military philosophy of;;In the medieval military philosophy of
3928;12846;;In times of peace, Gallia's army is made;;In times of peace, Gallia's army is made
5096;12887;;Industrial Revolution, it has become a;;Industrial Revolution, it has become a
4348;12926;;Installed in Fouzen upon its completion,;;Installed in Fouzen upon its completion,
5456;12967;;Isara's father, Theimer, this bi-winged,;;Isara's father, Theimer, this bi-winged,
3460;13008;;It has been shown that Valkyrur royalty;;It has been shown that Valkyrur royalty
5056;13048;;It luminesces a characteristic blue hue;;It luminesces a characteristic blue hue
4420;13088;;It represents the enhanced version of an;;It represents the enhanced version of an
3432;13129;;It uses a set of characters comprised of;;It uses a set of characters comprised of
3284;13170;;It wasn't long before the forces of both;;It wasn't long before the forces of both
1652;13211;;Its single magnificent tower has been;;Its single magnificent tower has been
3992;13249;;Led by the Emperor, the Empire's;;Led by the Emperor, the Empire's
4664;13282;;Legends of the War of the Valkyrur and a;;Legends of the War of the Valkyrur and a
4280;13323;;Length:       39m   Width: 4.25m;;Length:       39m   Width: 4.25m
4472;13356;;Length:    142.5m    Width:    35.2m;;Length:    142.5m    Width:    35.2m
4376;13393;;Length:    20.11m  Width: 10.03m;;Length:    20.11m  Width: 10.03m
5432;13426;;Length: 11.6m     Width:  12.5m;;Length: 11.6m     Width:  12.5m
5236;13458;;Lion's Paw;;Lion's Paw
3648;13469;;Major practices for celebrating the day;;Major practices for celebrating the day
4468;13509;;Marmota;;Marmota
2648;13517;;Massive and stalwart, this fortress sits;;Massive and stalwart, this fortress sits
4432;13558;;Maximilian, the body was reinforced and;;Maximilian, the body was reinforced and
4412;13598;;Maximilian, the leader of the Imperial;;Maximilian, the leader of the Imperial
1684;13637;;Military Headquarters;;Military Headquarters
1328;13659;;"Mills"" built from an old castle tower in";;"Mills"" built from an old castle tower in"
5068;13700;;Mined primarily in mountainous regions,;;Mined primarily in mountainous regions,
5208;13740;;New properties and applications for the;;New properties and applications for the
3960;13780;;Officers from the Gallian Army are;;Officers from the Gallian Army are
3412;13815;;Old Northern Script;;Old Northern Script
3800;13835;;One of Gallia's national precepts states;;One of Gallia's national precepts states
2456;13876;;One of several stretches of open shore;;One of several stretches of open shore
4020;13915;;Operating under a code of conduct with;;Operating under a code of conduct with
4232;13954;;Originally used to cross trenches and as;;Originally used to cross trenches and as
6008;13995;;Partially due to barren arsenals and a;;Partially due to barren arsenals and a
1896;14034;;Poor roads, violent peaks and valleys,;;Poor roads, violent peaks and valleys,
2952;14073;;Popular uprisings spurred on by the late;;Popular uprisings spurred on by the late
5332;14114;;Porcavians;;Porcavians
4388;14125;;Power: 1200hp/2400rpm;;Power: 1200hp/2400rpm
4484;14147;;Power: 208000hp;;Power: 208000hp
5444;14163;;Power: 50hp/2200rpm x2;;Power: 50hp/2200rpm x2
4292;14186;;Power: 980hp/1400rpm;;Power: 980hp/1400rpm
4132;14207;;Professor Theimer, creator of the tank;;Professor Theimer, creator of the tank
5044;14246;;Ragnite;;Ragnite
5592;14254;;Randgriz was buried even more thoroughly;;Randgriz was buried even more thoroughly
1232;14295;;Randgriz, the hereditary sovereigns of;;Randgriz, the hereditary sovereigns of
5776;14334;;Recent use of Darcsen labor to mine and;;Recent use of Darcsen labor to mine and
5160;14374;;Refined into liquid ragnoline, it can;;Refined into liquid ragnoline, it can
3840;14412;;Schools of each level offer mandatory;;Schools of each level offer mandatory
5648;14450;;Sea, much of their historical origin;;Sea, much of their historical origin
4104;14487;;Seeing the production of arms as a part;;Seeing the production of arms as a part
4568;14527;;Some Europans hold the Valkyrur as the;;Some Europans hold the Valkyrur as the
3296;14566;;Soon, all of Europa was caught up in a;;Soon, all of Europa was caught up in a
1456;14605;;Stretched thin between multiple fronts,;;Stretched thin between multiple fronts,
4180;14645;;Tanks;;Tanks
4708;14651;;That said, the bloodline is believed to;;That said, the bloodline is believed to
1972;14691;;The Barious Desert;;The Barious Desert
2232;14710;;The Barious Temple served to disseminate;;The Barious Temple served to disseminate
5428;14751;;"The Biplane ""ISARA""";;"The Biplane ""ISARA"""
1588;14771;;The Capital City Randgriz;;The Capital City Randgriz
2644;14797;;The Citadel at Ghirlandaio;;The Citadel at Ghirlandaio
3508;14824;;The Darcsen Hunts;;The Darcsen Hunts
2468;14842;;The Empire turned the sheer cliffs that;;The Empire turned the sheer cliffs that
3604;14882;;The Feast of All Spirits;;The Feast of All Spirits
3124;14907;;The First Europan War;;The First Europan War
3892;14929;;The Gallian Army;;The Gallian Army
1688;14946;;The Gallian Army's central base stands;;The Gallian Army's central base stands
1780;14985;;The Great Vasel Bridge;;The Great Vasel Bridge
3988;15008;;The Imperial Army;;The Imperial Army
4040;15026;;The Imperial army was the first to;;The Imperial army was the first to
3144;15061;;The Industrial Revolution of the 18th;;The Industrial Revolution of the 18th
2856;15099;;The Industrial Revolution that occurred;;The Industrial Revolution that occurred
1876;15139;;The Kloden Wildwood;;The Kloden Wildwood
4852;15159;;The Lance and Shield;;The Lance and Shield
2452;15180;;The Marberry Shore;;The Marberry Shore
2548;15199;;The Naggiar Plains;;The Naggiar Plains
1204;15218;;The Principality of Gallia;;The Principality of Gallia
3220;15245;;The Second Europan War;;The Second Europan War
5620;15268;;The Valkyrur;;The Valkyrur
3316;15281;;The War of the Valkyrur;;The War of the Valkyrur
4596;15305;;The Yggdist faith arose at the start of;;The Yggdist faith arose at the start of
3480;15345;;The ancient Darcsens were also thought;;The ancient Darcsens were also thought
4760;15384;;The ancient Valkyrur invaded Europa from;;The ancient Valkyrur invaded Europa from
3320;15425;;The ancient Valkyrur united the Europan;;The ancient Valkyrur united the Europan
1800;15465;;The bridge has its origins in the late;;The bridge has its origins in the late
1592;15504;;The capital of Gallia since its days as;;The capital of Gallia since its days as
2280;15544;;The city is divided between an upper and;;The city is divided between an upper and
1836;15585;;The city of Vasel grew out from either;;The city of Vasel grew out from either
1608;15624;;The city takes its name from the ancient;;The city takes its name from the ancient
2296;15665;;The city's layout allows for ragnite ore;;The city's layout allows for ragnite ore
4692;15706;;The generally held view of this race is;;The generally held view of this race is
3728;15746;;The human-shaped dolls, made of thatched;;The human-shaped dolls, made of thatched
3568;15787;;The increased need for labor brought on;;The increased need for labor brought on
2188;15827;;The interior takes the form of a massive;;The interior takes the form of a massive
2088;15868;;The main temple, said to have been built;;The main temple, said to have been built
2964;15909;;The nascent Empire, formed to the east,;;The nascent Empire, formed to the east,
1400;15949;;The nation was formally born in the 3rd;;The nation was formally born in the 3rd
1276;15989;;The official currency is the ducat, and;;The official currency is the ducat, and
5528;16029;;The original ancestors of House Randgriz;;The original ancestors of House Randgriz
2936;16070;;The product of an alliance among a large;;The product of an alliance among a large
2032;16111;;The remnants of human dwellings dot the;;The remnants of human dwellings dot the
4868;16151;;The shields are round, while the lances;;The shields are round, while the lances
3620;16191;;The spirits of the earth, driven away by;;The spirits of the earth, driven away by
2072;16232;;The structures found across the badlands;;The structures found across the badlands
1348;16273;;The town supposedly began as a hideout;;The town supposedly began as a hideout
1928;16312;;The woods are home to foxes, squirrels;;The woods are home to foxes, squirrels
3416;16351;;The written form of Old Northern, the;;The written form of Old Northern, the
5864;16389;;Theimer came together to develop a new;;Theimer came together to develop a new
4204;16428;;Their design employs a ragnoline;;Their design employs a ragnoline
5656;16461;;Their ragnite weaponry allegedly granted;;Their ragnite weaponry allegedly granted
2044;16502;;These days, violent sandstorms assail;;These days, violent sandstorms assail
5624;16540;;These immigrants from the north are said;;These immigrants from the north are said
4812;16581;;They authored a history in which they;;They authored a history in which they
2508;16619;;This bloody beach marked the end of the;;This bloody beach marked the end of the
3032;16659;;This calendar, used across Europa, has;;This calendar, used across Europa, has
1880;16698;;This expansive primeval forest stretches;;This expansive primeval forest stretches
1784;16739;;This massive iron drawbridge spans the;;This massive iron drawbridge spans the
1304;16778;;This small town lies on the Imperial;;This small town lies on the Imperial
1224;16815;;This small, central Europan nation is a;;This small, central Europan nation is a
3244;16855;;Though EWI ended in a stalemate, both;;Though EWI ended in a stalemate, both
2996;16893;;Though a series of secret alliances and;;Though a series of secret alliances and
5496;16933;;Though aeronautics research began across;;Though aeronautics research began across
5640;16974;;Though believed to be an oceanic tribe;;Though believed to be an oceanic tribe
5376;17013;;Though some have argued that its wings;;Though some have argued that its wings
3752;17052;;Though the basic doll is of traditional;;Though the basic doll is of traditional
4288;17092;;Top Speed: 20km/h;;Top Speed: 20km/h
4480;17110;;Top Speed: 25km/h;;Top Speed: 25km/h
4384;17128;;Top Speed: 30km/h;;Top Speed: 30km/h
5440;17146;;Top Speed: 75km/h;;Top Speed: 75km/h
3704;17164;;Traditionally made by Darcsen people as;;Traditionally made by Darcsen people as
2596;17204;;Trenches dug during EWI also remain,;;Trenches dug during EWI also remain,
6060;17241;;Unable to rival the Empire in technology;;Unable to rival the Empire in technology
5964;17282;;Unable to stand up to the Empire's tank;;Unable to stand up to the Empire's tank
2168;17322;;Undiscovered until quite recently, the;;Undiscovered until quite recently, the
4856;17361;;Unearthed from excavation sites across;;Unearthed from excavation sites across
3796;17400;;Universal Conscription;;Universal Conscription
5140;17423;;Uses of Ragnite;;Uses of Ragnite
4948;17439;;Valkof;;Valkof
4564;17446;;Valkyria Worship;;Valkyria Worship
4660;17463;;Valkyrur Common Knowledge;;Valkyrur Common Knowledge
4756;17489;;Valkyrur Historical Truth;;Valkyrur Historical Truth
4580;17515;;Valkyrur are understood as either gods;;Valkyrur are understood as either gods
5552;17554;;Valkyrur conquest.;;Valkyrur conquest.
4804;17573;;Valkyrur shifted blame for devastating;;Valkyrur shifted blame for devastating
4680;17612;;Valkyrur's existence pervades the land;;Valkyrur's existence pervades the land
2116;17651;;Valkyrur, written in Old Northern;;Valkyrur, written in Old Northern
1788;17685;;Vasel river, which flows into Lake Graz;;Vasel river, which flows into Lake Graz
5756;17725;;War of the Valkyrur. For their crimes of;;War of the Valkyrur. For their crimes of
1416;17766;;When the Empire invaded Gallia at the;;When the Empire invaded Gallia at the
2892;17804;;While not technically an autocracy, the;;While not technically an autocracy, the
1316;17844;;Windmills stand atop the crests of many;;Windmills stand atop the crests of many
1496;17884;;With the sea at its north and west and;;With the sea at its north and west and
1720;17923;;Within its walls lie the army's command;;Within its walls lie the army's command
5564;17963;;a city-state to rule (today's Randgriz),;;a city-state to rule (today's Randgriz),
2236;18004;;a false history to the masses while the;;a false history to the masses while the
2584;18044;;a few scraggly patches of grass remain;;a few scraggly patches of grass remain
4512;18083;;a joint effort with the Imperial navy,;;a joint effort with the Imperial navy,
1596;18122;;a monarchy, this ancient city has the;;a monarchy, this ancient city has the
2972;18160;;a mutual defense agreement among these;;a mutual defense agreement among these
2876;18199;;a network of marriages amongst their;;a network of marriages amongst their
4904;18236;;a physical alteration to the weapons';;a physical alteration to the weapons'
1528;18274;;a rich store of ragnite ore, a valued;;a rich store of ragnite ore, a valued
3260;18312;;a short 20-year pause, the Empire began;;a short 20-year pause, the Empire began
3828;18352;;a three-stage draft according to need,;;a three-stage draft according to need,
5468;18391;;a vertical rudder. Isara expanded the;;a vertical rudder. Isara expanded the
2396;18429;;abducted and used as slave labor, made;;abducted and used as slave labor, made
4916;18468;;abilities.;;abilities.
4784;18479;;able to unleash the latent power within;;able to unleash the latent power within
1884;18519;;across Gallia's south, forming a natural;;across Gallia's south, forming a natural
3940;18560;;addition to the autonomous town watches;;addition to the autonomous town watches
5932;18600;;after EWI began as a force of extremely;;after EWI began as a force of extremely
1356;18640;;against the king. Perhaps in echo of;;against the king. Perhaps in echo of
4604;18677;;all regions of Europa. Its tenets hold;;all regions of Europa. Its tenets hold
3720;18716;;all times.;;all times.
1828;18727;;allowed it to be operated by extending;;allowed it to be operated by extending
4120;18766;;also helped keep weapons technology and;;also helped keep weapons technology and
3044;18806;;also known as the Valkyrian calendar.;;also known as the Valkyrian calendar.
4156;18844;;amassed his considerable knowledge;;amassed his considerable knowledge
1692;18879;;amid a wooded area at the outskirts of;;amid a wooded area at the outskirts of
2988;18918;;among the constituent republics, meaning;;among the constituent republics, meaning
4912;18959;;amplifiers for the race's preternatural;;amplifiers for the race's preternatural
